,content,date,text,Length,sid_sentiment,finbert_label
1485,"['plan', 'trade', 'rate', 'meet', 'plu']",20201207 0700260000,plan trade rate meet plu,5,0.0,0
1487,"['baromet', 'travel', 'pandem', 'via']",20201207 0659240000,baromet travel pandem via,4,0.0,0
1488,"['big', 'chunk', 'revenu', 'come', 'illeg', 'regul', 'ahead']",20201207 0656530000,big chunk revenu come illeg regul ahead,7,0.0,0
1489,"['week', 'ahead', 'look', 'ahead', 'main', 'shape', 'week']",20201207 0654550000,week ahead look ahead main shape week,7,0.0,0
1490,"['week', 'ahead', 'look', 'ahead', 'main', 'shape', 'week']",20201207 0654500000,week ahead look ahead main shape week,7,0.0,0
1491,"['rais', 'ahead', 'blockbust', 'week']",20201207 0645520000,rais ahead blockbust week,4,0.0,0
1492,"['la', 'di', 'per', 'punta', 'un', 'di']",20201207 0644320000,la di per punta un di,6,0.0,0
1493,"['rais', 'ahead', 'blockbust', 'week']",20201207 0643010000,rais ahead blockbust week,4,0.0,0
1494,"['rais', 'price', 'target', 'rang', 'sourc']",20201207 0642460000,rais price target rang sourc,5,0.0,0
1495,"['rais', 'ahead', 'blockbust', 'week']",20201207 0641330000,rais ahead blockbust week,4,0.0,0
1496,"['rais', 'ahead', 'blockbust', 'week']",20201207 0641330000,rais ahead blockbust week,4,0.0,0
1497,"['boost', 'price', 'ahead', 'week']",20201207 0641270000,boost price ahead week,4,0.4019,0
1498,['seek'],20201207 0640020000,seek,1,0.0,0
1499,"['die', 'van', 'van', 'surg', 'via']",20201207 0638320000,die van van surg via,5,-0.5994,0
1500,"['rais', 'ahead', 'blockbust', 'week']",20201207 0637300000,rais ahead blockbust week,4,0.0,0
1501,"['price', 'rang', 'share']",20201207 0635050000,price rang share,3,0.296,0
1503,"['price', 'rang', 'would', 'give', 'compani', 'valuat', 'high', 'sour']",20201207 0632320000,price rang would give compani valuat high sour,8,0.0,1
1504,"['take', 'analysi', 'big', 'brain']",20201207 0631460000,take analysi big brain,4,0.0,0
1505,['seek'],20201207 0630400000,seek,1,0.0,0
1506,"['vaccin', 'review', 'know', 'week', 'ahead', 'via', 'yahoo']",20201207 0629540000,vaccin review know week ahead via yahoo,7,0.0,0
1507,"['set', 'record', 'us', 'readi', 'start', 'trade', 'week']",20201207 0629070000,set record us readi start trade week,7,0.0,0
1508,['seek'],20201207 0628200000,seek,1,0.0,0
1509,['seek'],20201207 0625310000,seek,1,0.0,0
1510,['seek'],20201207 0623110000,seek,1,0.0,0
1511,"['rais', 'ahead', 'blockbust', 'week']",20201207 0617310000,rais ahead blockbust week,4,0.0,0
1512,"['actual', 'think', 'could', 'poorli', 'initi', 'play', 'pure', 'driven', 'posit', 'bia', 'great', 'platform', 'true', 'first', 'option', 'away', 'home', 'huge', 'may']",20201207 0616400000,actual think could poorli initi play pure driven posit bia great platform true first option away home huge may,19,0.891,0
1513,"['boost', 'price', 'rang', 'share', 'valuat', 'fulli', 'dilut']",20201207 0614030000,boost price rang share valuat fulli dilut,7,0.5994,1
1514,"['boost', 'price', 'rang', 'billion', 'valu', 'busi', 'economi', 'leadership', 'manag', 'tech', 'stock', 'realtor']",20201207 0611580000,boost price rang billion valu busi economi leadership manag tech stock realtor,12,0.4019,1
1515,"['feel', 'one', 'hold', 'quick', 'let', 'know']",20201207 0610500000,feel one hold quick let know,6,0.0,0
1516,"['baromet', 'travel']",20201207 0606300000,baromet travel,2,0.0,0
1517,"['upcom', 'month', 'wish']",20201207 0605370000,upcom month wish,3,0.4019,0
1518,"['yahoo', 'financ', 'vaccin', 'review', 'know', 'week']",20201207 0603550000,yahoo financ vaccin review know week,6,0.0,0
1519,"['rais', 'price', 'target', 'rang']",20201207 0549300000,rais price target rang,4,0.0,0
1520,"['rais', 'price', 'target', 'rang']",20201207 0549290000,rais price target rang,4,0.0,0
1521,"['us', 'week', 'ahead', 'kick', 'unicorn', 'parad', 'week']",20201207 0548100000,us week ahead kick unicorn parad week,7,0.0,0
1522,"['son', 'sur', 'un', 'mon', 'pote']",20201207 0543420000,son sur un mon pote,5,0.0,0
1523,"['rais', 'price', 'target', 'rang', 'sourc']",20201207 0542400000,rais price target rang sourc,5,0.0,0
1524,"['v', 'v']",20201207 0538070000,v v,2,0.0,0
1525,"['valuat', 'stock']",20201207 0538050000,valuat stock,2,0.0,0
1526,"['need', 'busi', 'better', 'way', 'forward', 'think', 'understand', 'great', 'see', 'build', 'someth', 'like']",20201207 0536300000,need busi better way forward think understand great see build someth like,12,0.8591,0
1527,"['growth', 'tech']",20201207 0533210000,growth tech,2,0.3818,0
1528,"['baromet', 'travel', 'pandem', 'compani', 'batter', 'year', 'chang', 'consum']",20201207 0531080000,baromet travel pandem compani batter year chang consum,8,0.0,0
1529,"['baromet', 'travel', 'pandem']",20201207 0530570000,baromet travel pandem,3,0.0,0
1530,"['de', 'son', 'introduct', 'en', 'bours', 'via']",20201207 0530020000,de son introduct en bours via,6,0.0,0
1531,"['plan', 'rais', 'target', 'price', 'covid', 'year', 'bit', 'surpris', 'consid', 'drop', 'travel', 'valuat', 'improv', 'could', 'due', 'growth', 'come']",20201207 0526060000,plan rais target price covid year bit surpris consid drop travel valuat improv could due growth come,17,0.128,0
1532,"['vaccin', 'review', 'know', 'week', 'ahead', 'via', 'yahoo']",20201207 0524480000,vaccin review know week ahead via yahoo,7,0.0,0
1533,"['back', 'apart', 'swap', 'home', 'exchang', 'site', 'quickli', 'didnt', 'want', 'pay', 'eventu', 'shut', 'wasnt', 'properli', 'least', 'free', 'stay']",20201207 0521570000,back apart swap home exchang site quickli didnt want pay eventu shut wasnt properli least free stay,17,0.3255,0
1534,"['rais', 'price', 'target', 'rang', 'sourc', 'articl']",20201207 0516490000,rais price target rang sourc articl,6,0.0,0
1535,"['rais', 'price', 'target', 'rang', 'sourc']",20201207 0516040000,rais price target rang sourc,5,0.0,0
1536,"['rais', 'price', 'target', 'rang', 'sourc']",20201207 0515030000,rais price target rang sourc,5,0.0,0
1537,"['go', 'public', 'week', 'significantli', 'rais', 'price', 'group', 'billion', 'wall', 'street', 'journal']",20201207 0514470000,go public week significantli rais price group billion wall street journal,11,0.0,0
1539,"['face', 'sham', 'oddli', 'enough', 'notabl', 'million', 'could', 'repres', 'billion', 'sharehold', 'valu']",20201207 0511370000,face sham oddli enough notabl million could repres billion sharehold valu,11,0.0,0
1540,"['poco', 'se', 'el', 'de', 'el', 'la', 'sale', 'en', 'el', 'de', 'la', 'es', 'de']",20201207 0511070000,poco se el de el la sale en el de la es de,13,0.0,0
1541,"['rais', 'price', 'target', 'rang', 'sourc']",20201207 0508310000,rais price target rang sourc,5,0.0,0
1543,"['hot', 'market', 'price', 'rang', 'share', 'via']",20201207 0504330000,hot market price rang share via,6,0.296,0
1544,"['boost', 'price', 'rang', 'share', 'valuat', 'fulli', 'dilut']",20201207 0503330000,boost price rang share valuat fulli dilut,7,0.5994,1
1545,['price'],20201207 0503290000,price,1,0.0,0
1546,"['supposedli', 'week', 'buy', 'long', 'term', 'port', 'forget', 'em', 'thank', 'like']",20201207 0502250000,supposedli week buy long term port forget em thank like,10,0.4767,0
1547,"['baromet', 'travel', 'pandem']",20201207 0501020000,baromet travel pandem,3,0.0,0
1548,"['baromet', 'travel', 'pandem']",20201207 0501010000,baromet travel pandem,3,0.0,0
1549,"['set', 'record', 'us', 'readi', 'start', 'trade', 'week']",20201207 0500270000,set record us readi start trade week,7,0.0,0
1551,"['could', 'top', 'rang', 'signal', 'top', 'increas', 'price', 'rang', 'peopl', 'familiar', 'matter', 'push', 'potenti', 'valuat', 'much', 'via', 'technolog']",20201207 0458280000,could top rang signal top increas price rang peopl familiar matter push potenti valuat much via technolog,17,0.4019,0
1553,"['price', 'rang', 'share', 'potenti', 'valuat', 'debut', 'price', 'valuat', 'billion']",20201207 0449160000,price rang share potenti valuat debut price valuat billion,9,0.296,0
1554,"['boost', 'price', 'rang', 'billion', 'valu']",20201207 0446530000,boost price rang billion valu,5,0.4019,1
1557,"['price', 'rang', 'immin']",20201207 0442400000,price rang immin,3,0.0,0
1558,"['go', 'list', 'week', 'possibl', 'great', 'play', 'vaccin', 'come', 'soon', 'anoth', 'watch', 'dash']",20201207 0441320000,go list week possibl great play vaccin come soon anoth watch dash,12,0.7579,0
1559,"['increas', 'price', 'report']",20201207 0440000000,increas price report,3,0.0,0
1560,"['watch', 'dash', 'new']",20201207 0438280000,watch dash new,3,0.0,0
1561,"['boost', 'price', 'rang', 'share', 'valuat', 'fulli', 'dilut', 'street', 'journal']",20201207 0436370000,boost price rang share valuat fulli dilut street journal,9,0.5994,0
1562,"['boost', 'price', 'rang', 'share', 'valuat', 'fulli', 'dilut', 'street', 'journal']",20201207 0435020000,boost price rang share valuat fulli dilut street journal,9,0.5994,0
1563,"['rais', 'price', 'target', 'rang', 'sourc']",20201207 0431250000,rais price target rang sourc,5,0.0,0
1564,"['rais', 'price', 'target', 'rang', 'sourc']",20201207 0430070000,rais price target rang sourc,5,0.0,0
1565,"['accord', 'go', 'public', 'list', 'stock', 'exchang', 'platform', 'symbol']",20201207 0428130000,accord go public list stock exchang platform symbol,8,0.0,0
1566,"['realli', 'start', 'look', 'like', 'move']",20201207 0426360000,realli start look like move,5,0.3612,0
1567,"['si', 'en', 'la']",20201207 0425460000,si en la,3,0.0,0
1568,"['de', 'la', 'es', 'hay', 'ya', 'se', 'ya']",20201207 0424590000,de la es hay ya se ya,7,0.0,0
1569,"['look', 'forward', 'stock']",20201207 0422090000,look forward stock,3,0.0,0
1570,"['head', 'week', 'last', 'week', 'reiter', 'turn', 'rental', 'brand', 'carbon', 'copi', 'instead', 'hell', 'focu', 'luxuri']",20201207 0421490000,head week last week reiter turn rental brand carbon copi instead hell focu luxuri,14,-0.6808,0
1571,['week'],20201207 0419450000,week,1,0.0,0
1572,"['boost', 'price', 'ahead', 'week', 'us']",20201207 0419360000,boost price ahead week us,5,0.4019,0
1573,"['set', 'record', 'us', 'readi', 'start', 'trade', 'week']",20201207 0419090000,set record us readi start trade week,7,0.0,0
1574,"['set', 'begin', 'trade']",20201207 0415580000,set begin trade,3,0.0,0
1575,"['boost', 'price', 'rang', 'initi', 'public', 'offer', 'share', 'accord', 'peopl', 'familiar', 'matter', 'latest', 'sign', 'market', 'end', 'year', 'high', 'note']",20201207 0414250000,boost price rang initi public offer share accord peopl familiar matter latest sign market end year high note,18,0.6124,1
1576,"['increas', 'price', 'report', 'giant', 'go', 'public', 'week', 'significantli', 'rais', 'price', 'group', 'billion', 'wall', 'street']",20201207 0410020000,increas price report giant go public week significantli rais price group billion wall street,14,0.0,0
1577,"['valuat', 'stock']",20201207 0409020000,valuat stock,2,0.0,0
1578,"['price', 'rang', 'immin']",20201207 0409020000,price rang immin,3,0.0,0
1579,"['top', 'price', 'rang', 'share', 'see']",20201207 0405120000,top price rang share see,5,0.4588,0
1580,"['price', 'rang', 'immin']",20201207 0405100000,price rang immin,3,0.0,0
1581,"['rais', 'price', 'target', 'rang', 'sourc', 'tech']",20201207 0403220000,rais price target rang sourc tech,6,0.0,0
1582,"['doubt', 'rais', 'within', 'day']",20201207 0402490000,doubt rais within day,4,-0.3612,0
1583,"['price', 'rang', 'share', 'wall']",20201207 0359190000,price rang share wall,4,0.296,0
1584,"['es', 'el', 'de']",20201207 0355140000,es el de,3,0.0,0
1585,"['set', 'record', 'us', 'readi', 'start', 'trade', 'week']",20201207 0351440000,set record us readi start trade week,7,0.0,0
1586,"['boost', 'price', 'ahead', 'week', 'u', 'ai', 'bac']",20201207 0351240000,boost price ahead week u ai bac,7,0.4019,0
1587,"['dont', 'know', 'what', 'go', 'pretti', 'excit', 'interest', 'twist']",20201207 0351050000,dont know what go pretti excit interest twist,8,0.4588,0
1588,"['increas', 'price', 'report']",20201207 0350000000,increas price report,3,0.0,0
1589,"['highli', 'dash', 'among', 'next', 'week', 'enterpris', 'artifici', 'intellig', 'compani', 'ai', 'compani', 'affirm', 'also', 'mani']",20201207 0347350000,highli dash among next week enterpris artifici intellig compani ai compani affirm also mani,14,0.0,0
1591,"['increas', 'price', 'report']",20201207 0344240000,increas price report,3,0.0,0
1593,"['increas', 'price', 'report']",20201207 0335390000,increas price report,3,0.0,0
1594,"['stock', 'invest']",20201207 0330360000,stock invest,2,0.0,0
1595,"['increas', 'price', 'report']",20201207 0330320000,increas price report,3,0.0,0
1596,"['peopl', 'load', 'float', 'os', 'squeez', 'close', 'launch', 'current', 'market', 'cap', 'expect', 'number', 'increas', 'daili', 'week']",20201207 0329520000,peopl load float os squeez close launch current market cap expect number increas daili week,15,0.0772,0
1597,"['fell', 'flat', 'last', 'year', 'market', 'plan', 'inspir', 'market']",20201207 0329190000,fell flat last year market plan inspir market,8,0.0,-1
1599,"['dont', 'forget']",20201207 0322450000,dont forget,2,0.1695,0
1600,"['reportedli', 'rais', 'price', 'rang', 'new', 'rang', 'accord', 'would', 'repres', 'market', 'cap', 'start', 'trade', 'upcom', 'week']",20201207 0321560000,reportedli rais price rang new rang accord would repres market cap start trade upcom week,15,0.0,0
1601,"['major', 'week', 'watch', 'price', 'around', 'go', 'live', 'dash', 'door', 'dash', 'price', 'around', 'ai', 'ai', 'price', 'around']",20201207 0321400000,major week watch price around go live dash door dash price around ai ai price around,16,0.0,0
1602,"['rang', 'share', 'peopl', 'familiar', 'matter', 'said', 'new', 'rang', 'would', 'give', 'compani', 'valuat', 'much', 'billion', 'fulli', 'dilut', 'basi', 'stock']",20201207 0319190000,rang share peopl familiar matter said new rang would give compani valuat much billion fulli dilut basi stock,18,0.3182,0
1603,"['valuat', 'via']",20201207 0319170000,valuat via,2,0.0,0
1604,"['definit', 'happen', 'month', 'sure', 'yet', 'trade', 'want', 'especi', 'sinc', 'see', 'red', 'day', 'mile', 'away', 'cheap']",20201207 0317020000,definit happen month sure yet trade want especi sinc see red day mile away cheap,15,0.3818,0
1605,"['dont', 'get']",20201207 0316140000,dont get,2,0.0,0
1606,"['increas', 'price', 'report']",20201207 0312570000,increas price report,3,0.0,0
1607,"['dash', 'vaccin', 'review', 'know', 'week', 'ahead']",20201207 0312530000,dash vaccin review know week ahead,6,0.0,0
1608,"['dash', 'valuat']",20201207 0310320000,dash valuat,2,0.0,0
1609,"['rais', 'price', 'target', 'rang', 'sourc']",20201207 0310180000,rais price target rang sourc,5,0.0,0
1610,"['rais', 'price', 'target', 'rang', 'sourc']",20201207 0308030000,rais price target rang sourc,5,0.0,0
1611,"['week', 'price', 'rang']",20201207 0307530000,week price rang,3,0.0,0
1613,"['dash', 'week', 'better', 'sleep']",20201207 0304190000,dash week better sleep,4,0.4404,1
1614,"['interest', 'week', 'chewi', 'adob', 'oracl', 'also', 'start', 'trade']",20201207 0301110000,interest week chewi adob oracl also start trade,8,0.4588,0
1616,"['huge', 'increas', 'valuat', 'like', 'increas', 'daili', 'open', 'trade', 'price', 'say']",20201207 0300310000,huge increas valuat like increas daili open trade price say,10,0.5859,0
1617,"['wish', 'affirm', 'stock', 'growth']",20201207 0259090000,wish affirm stock growth,4,0.6486,0
1618,"['rais', 'price', 'target', 'rang']",20201207 0258190000,rais price target rang,4,0.0,0
1619,"['vaccin', 'review', 'know', 'week', 'ahead', 'via', 'yahoo']",20201207 0257370000,vaccin review know week ahead via yahoo,7,0.0,0
1620,"['price', 'rang', 'share']",20201207 0255500000,price rang share,3,0.296,0
1621,['get'],20201207 0255300000,get,1,0.0,0
1622,['get'],20201207 0254520000,get,1,0.0,0
1623,['get'],20201207 0254390000,get,1,0.0,0
1624,"['valuat', 'dash']",20201207 0254000000,valuat dash,2,0.0,0
1625,"['price', 'rang']",20201207 0253180000,price rang,2,0.0,0
1626,['valuat'],20201207 0252500000,valuat,1,0.0,0
1627,['valuat'],20201207 0252310000,valuat,1,0.0,0
1628,"['price', 'rang', 'share']",20201207 0251260000,price rang share,3,0.296,0
1629,"['rais', 'price', 'target', 'rang', 'sourc']",20201207 0251060000,rais price target rang sourc,5,0.0,0
1630,"['host', 'last', 'certain', 'amount', 'offer', 'buy', 'worth', 'stock']",20201207 0250420000,host last certain amount offer buy worth stock,8,0.4588,0
1631,"['rais', 'price']",20201207 0249330000,rais price,2,0.0,0
1632,"['commentari', 'list', 'week', 'worth', 'invest']",20201207 0248030000,commentari list week worth invest,5,0.2263,0
1633,"['go', 'live']",20201207 0246420000,go live,2,0.0,0
1634,"['hike', 'price', 'rang', 'also', 'price', 'top', 'rang', 'dash', 'set', 'debut', 'week', 'respect', 'interest', 'week']",20201207 0246390000,hike price rang also price top rang dash set debut week respect interest week,14,0.7845,1
1635,"['hot', 'bet', 'known', 'sever']",20201207 0244290000,hot bet known sever,4,0.0,0
1636,"['price', 'rang', 'share', 'dash']",20201207 0243180000,price rang share dash,4,0.296,0
1637,"['price', 'rang', 'share']",20201207 0241310000,price rang share,3,0.296,0
1638,"['valuat', 'invest', 'stock', 'money', 'invest', 'financ', 'trade']",20201207 0240040000,valuat invest stock money invest financ trade,7,0.0,0
1639,"['news', 'exclus', 'price', 'rang']",20201207 0237340000,news exclus price rang,4,0.0,0
1640,"['price', 'rang', 'share', 'present', 'first', 'trade', 'servic', 'retail', 'accuraci', 'ratio', 'ai', 'per', 'month', 'us']",20201207 0231160000,price rang share present first trade servic retail accuraci ratio ai per month us,14,0.296,0
1641,"['de', 'la', 'saber', 'en', 'la', 'de', 'la', 'de', 'de']",20201207 0230330000,de la saber en la de la de de,9,0.0,0
1644,"['boost', 'price', 'rang', 'share', 'valuat', 'fulli', 'dilut', 'street', 'journal']",20201207 0223260000,boost price rang share valuat fulli dilut street journal,9,0.5994,0
1645,"['rais', 'price', 'target', 'rang']",20201207 0223230000,rais price target rang,4,0.0,0
1646,"['news', 'exclus', 'price', 'rang', 'share', 'boost']",20201207 0220480000,news exclus price rang share boost,6,0.5994,0
1647,"['soon', 'think', 'overtim', 'stock', 'lot', 'potenti', 'wonder', 'bounc', 'back', 'pandem']",20201207 0216540000,soon think overtim stock lot potenti wonder bounc back pandem,10,0.0,0
1648,"['rais', 'price', 'target', 'rang', 'sourc', 'news']",20201207 0216230000,rais price target rang sourc news,6,0.0,0
1649,"['rais', 'price', 'target', 'rang', 'sourc']",20201207 0210120000,rais price target rang sourc,5,0.0,0
1651,"['rais', 'price', 'target', 'rang', 'sourc']",20201207 0208020000,rais price target rang sourc,5,0.0,0
1652,"['boost', 'price', 'rang', 'billion', 'valu']",20201207 0207060000,boost price rang billion valu,5,0.4019,1
1653,"['symbol', 'signific', 'price', 'rang', 'boost', 'none', 'underwat', 'new', 'rang', 'seri', 'f', 'previou']",20201207 0205380000,symbol signific price rang boost none underwat new rang seri f previou,12,0.4019,0
1654,"['para', 'mi', 'es', 'la', 'de', 'la', 'increas', 'price', 'rang', 'accord', 'peopl', 'familiar', 'matter', 'push', 'potenti', 'valuat', 'much', 'billion', 'de', 'technolog']",20201207 0204510000,para mi es la de la increas price rang accord peopl familiar matter push potenti valuat much billion de technolog,20,0.0258,0
1655,"['rais', 'price', 'target', 'rang']",20201207 0202140000,rais price target rang,4,0.0,0
1656,"['rais', 'price', 'target', 'rang', 'sourc']",20201207 0200190000,rais price target rang sourc,5,0.0,0
1657,"['top', 'stock', 'right', 'also', 'look']",20201207 0157320000,top stock right also look,5,0.2023,0
1658,"['rais', 'price', 'target', 'rang', 'sourc']",20201207 0156330000,rais price target rang sourc,5,0.0,0
1659,"['rais', 'price', 'target', 'rang', 'sourc']",20201207 0156320000,rais price target rang sourc,5,0.0,0
1660,"['price', 'rang', 'compani', 'boost', 'price', 'rang', 'initi', 'public', 'offer', 'share', 'latest', 'sign', 'market', 'end', 'year', 'busi', 'financ']",20201207 0154320000,price rang compani boost price rang initi public offer share latest sign market end year busi financ,17,0.5994,0
1661,"['typic', 'conserv', 'wouldnt', 'surpris', 'share', 'price', 'even', 'higher', 'first', 'day', 'trade']",20201207 0153450000,typic conserv wouldnt surpris share price even higher first day trade,11,-0.2235,1
1662,"['de', 'sale', 'bien']",20201207 0152110000,de sale bien,3,0.0,0
1664,"['boost', 'price', 'rang', 'share', 'valuat', 'fulli', 'dilut', 'street', 'journal']",20201207 0151250000,boost price rang share valuat fulli dilut street journal,9,0.5994,0
1665,"['busi', 'increas', 'price', 'rang', 'say', 'push', 'potenti', 'valuat', 'much', 'billion']",20201207 0150510000,busi increas price rang say push potenti valuat much billion,10,0.0,0
1666,"['boost', 'price', 'rang', 'billion', 'valu']",20201207 0149240000,boost price rang billion valu,5,0.4019,1
1667,"['oh', 'hell', 'valuat', 'insan', 'one']",20201207 0148070000,oh hell valuat insan one,5,-0.6808,0
1668,"['el', 'de', 'de', 'lo', 'la']",20201207 0145510000,el de de lo la,5,0.0,0
1669,"['rais', 'price', 'target', 'rang', 'sourc']",20201207 0145310000,rais price target rang sourc,5,0.0,0
1670,"['increas', 'price', 'rang', 'say', 'push', 'potenti', 'valuat', 'much', 'billion']",20201207 0143590000,increas price rang say push potenti valuat much billion,9,0.0,0
1671,"['increas', 'price', 'rang', 'say', 'push', 'potenti', 'valuat', 'much', 'billion']",20201207 0143370000,increas price rang say push potenti valuat much billion,9,0.0,0
1672,"['increas', 'price', 'rang', 'say', 'push', 'potenti', 'valuat', 'much', 'billion']",20201207 0143250000,increas price rang say push potenti valuat much billion,9,0.0,0
1673,"['increas', 'price', 'rang', 'say', 'push', 'potenti', 'valuat', 'much', 'billion']",20201207 0143190000,increas price rang say push potenti valuat much billion,9,0.0,0
1674,"['increas', 'price', 'rang', 'say', 'push', 'potenti', 'valuat', 'much', 'billion']",20201207 0143150000,increas price rang say push potenti valuat much billion,9,0.0,0
1675,"['boost', 'price', 'rang', 'share', 'valuat', 'fulli', 'dilut', 'street', 'journal']",20201207 0143030000,boost price rang share valuat fulli dilut street journal,9,0.5994,0
1676,"['increas', 'price', 'rang', 'say', 'push', 'potenti', 'valuat', 'much', 'billion']",20201207 0142010000,increas price rang say push potenti valuat much billion,9,0.0,0
1677,"['increas', 'price', 'rang', 'say', 'push', 'potenti', 'valuat', 'much', 'billion']",20201207 0141470000,increas price rang say push potenti valuat much billion,9,0.0,0
1678,"['boost', 'price', 'rang', 'share', 'valuat', 'fulli', 'dilut', 'wall', 'street']",20201207 0140470000,boost price rang share valuat fulli dilut wall street,9,0.5994,1
1679,"['price', 'increas', 'share']",20201207 0138530000,price increas share,3,0.296,0
1680,"['listen', 'recent', 'episod', 'blackberri', 'back', 'busi', 'plu', 'blackberri']",20201207 0130000000,listen recent episod blackberri back busi plu blackberri,8,0.0,0
1681,['via'],20201207 0127190000,via,1,0.0,0
1682,"['stock', 'buy', 'via']",20201207 0125350000,stock buy via,3,0.0,0
1683,"['rental', 'lodg', 'home', 'stay', 'tourism', 'compani', 'real', 'estat', 'platform', 'peopl', 'take', 'part', 'file', 'august']",20201207 0123030000,rental lodg home stay tourism compani real estat platform peopl take part file august,14,0.0,0
1684,"['next', 'week', 'could', 'time', 'get', 'hold']",20201207 0122050000,next week could time get hold,6,0.0,0
1685,"['analysi', 'air', 'think', 'see', 'major', 'pop', 'day']",20201207 0116580000,analysi air think see major pop day,7,0.0,0
1686,['day'],20201207 0115440000,day,1,0.0,0
1687,"['said', 'rais', 'prior', 'us', 'financi', 'press']",20201207 0113360000,said rais prior us financi press,6,0.0,0
1688,"['boost', 'price', 'rang', 'initi', 'public', 'offer']",20201207 0111340000,boost price rang initi public offer,6,0.4019,1
1689,"['price', 'rang', 'theyr', 'seek', 'valuat', 'covid', 'valuat', 'unexpect', 'busi', 'market', 'strong', 'valuat', 'may', 'still', 'jump', 'offici']",20201207 0108070000,price rang theyr seek valuat covid valuat unexpect busi market strong valuat may still jump offici,16,0.5106,-1
1690,"['price', 'rang', 'share']",20201207 0106210000,price rang share,3,0.296,0
1691,['week'],20201207 0105300000,week,1,0.0,0
1692,"['two', 'price', 'rang', 'upcom', 'reflect', 'wave', 'investor', 'interest', 'new', 'meanwhil', 'tsunami', 'million']",20201207 0105260000,two price rang upcom reflect wave investor interest new meanwhil tsunami million,12,0.4588,0
1693,"['economi', 'made', 'penni', 'sinc', 'price', 'rang']",20201207 0103330000,economi made penni sinc price rang,6,0.0,0
1694,"['keep', 'price', 'someon', 'share']",20201207 0103310000,keep price someon share,4,0.296,0
1695,"['well', 'receiv', 'strongli', 'watch', 'better']",20201207 0102300000,well receiv strongli watch better,5,0.6124,0
1696,['da'],20201207 0101590000,da,1,0.0,0
1697,"['price', 'rang', 'share']",20201207 0100370000,price rang share,3,0.296,0
1698,"['economi', 'come', 'home']",20201207 0100170000,economi come home,3,0.0,0
1699,"['want', 'post', 'sell', 'mid']",20201207 0100010000,want post sell mid,4,0.0772,0
1700,"['price', 'rang', 'share']",20201207 0058120000,price rang share,3,0.296,0
1701,"['price', 'rang', 'share']",20201207 0057440000,price rang share,3,0.296,0
1702,"['price', 'rang', 'per', 'share']",20201207 0057380000,price rang per share,4,0.296,0
1703,"['price', 'rang']",20201207 0057330000,price rang,2,0.0,0
1704,"['price', 'rang', 'share']",20201207 0057020000,price rang share,3,0.296,0
1705,"['boost', 'price', 'rang', 'share', 'peopl', 'familiar', 'matter', 'said', 'break', 'news']",20201207 0056530000,boost price rang share peopl familiar matter said break news,10,0.6124,0
1706,"['price', 'rang', 'share']",20201207 0056020000,price rang share,3,0.296,0
