,content,date,text,Length,sid_sentiment,finbert_label
2125,"['us', 'week', 'ahead', 'kick', 'unicorn', 'parad', 'week', 'stock']",20201208 0343410000,us week ahead kick unicorn parad week stock,8,0.0,0
2126,"['weve', 'field', 'lot', 'late', 'upcom', 'opinion', 'exactli', 'approach']",20201208 0341010000,weve field lot late upcom opinion exactli approach,8,0.0,0
2127,"['hybrid', 'auction', 'set', 'invest']",20201208 0327180000,hybrid auction set invest,4,0.0,0
2128,"['corona', 'capit', 'strong', 'curb', 'appeal', 'kill', 'print']",20201208 0325340000,corona capit strong curb appeal kill print,7,-0.34,1
2129,"['baromet', 'travel', 'pandem', 'via']",20201208 0322300000,baromet travel pandem via,4,0.0,0
2130,"['what', 'better', 'show', 'secondari', 'well', 'upcom', 'bow', 'episod', 'holiday', 'brillianc', 'incompar']",20201208 0319420000,what better show secondari well upcom bow episod holiday brillianc incompar,11,0.7717,0
2131,"['go', 'public', 'week', 'rang', 'share', 'wrote', 'yesterday', 'even', 'dive', 'read']",20201208 0319310000,go public week rang share wrote yesterday even dive read,10,0.296,0
2132,"['affirm', 'wish', 'file', 'tech', 'final']",20201208 0318070000,affirm wish file tech final,5,0.4019,0
2134,"['us', 'week', 'ahead', 'kick', 'unicorn', 'parad', 'week']",20201208 0316000000,us week ahead kick unicorn parad week,7,0.0,0
2135,"['list', 'rang', 'per', 'share', 'account', 'servic', 'clean', 'accommod', 'come', 'per', 'share']",20201208 0309380000,list rang per share account servic clean accommod come per share,11,0.7269,0
2136,"['hot', 'news', 'grade', 'walk', 'medium', 'see']",20201208 0306140000,hot news grade walk medium see,6,0.0,0
2137,"['ai', 'week', 'anywher', 'despit', 'crowd', 'bigger', 'name', 'team', 'elit', 'opaqu', 'capit', 'rate', 'best']",20201208 0258030000,ai week anywher despit crowd bigger name team elit opaqu capit rate best,13,0.6369,0
2139,"['stock', 'busi', 'model']",20201208 0253260000,stock busi model,3,0.0,0
2140,"['go', 'beset', 'relentless', 'variou', 'ban', 'social', 'justic', 'howev', 'realli', 'monopoli', 'ban']",20201208 0242310000,go beset relentless variou ban social justic howev realli monopoli ban,11,-0.7906,0
2141,"['low', 'key', 'kind', 'excit', 'gon', 'na', 'nibbl', 'em']",20201208 0240070000,low key kind excit gon na nibbl em,8,0.3182,0
2142,"['possibl', 'yet', 'trade', 'stock', 'within', 'list', 'welcom', 'instanc', 'go', 'list', 'soon', 'avail', 'upon', 'list']",20201208 0238440000,possibl yet trade stock within list welcom instanc go list soon avail upon list,14,0.0,0
2144,['file'],20201208 0231010000,file,1,0.0,0
2145,"['get', 'street', 'gon', 'na']",20201208 0230160000,get street gon na,4,0.0,0
2146,"['week', 'one', 'flop']",20201208 0225500000,week one flop,3,-0.34,0
2147,"['rang', 'silicon', 'valley', 'busi', 'journal', 'silicon', 'valley', 'rais', 'rang', 'share']",20201208 0220070000,rang silicon valley busi journal silicon valley rais rang share,10,0.296,0
2148,"['incred', 'avail', 'stock', 'wealth', 'money']",20201208 0217200000,incred avail stock wealth money,5,0.4939,0
2149,"['post', 'market', 'volatil', 'trigger', 'epic', 'dollar', 'squeez', 'tri', 'say', 'someth', 'today', 'buy', 'worth', 'trillion', 'spi', 'ba']",20201208 0217100000,post market volatil trigger epic dollar squeez tri say someth today buy worth trillion spi ba,16,0.2263,0
2150,"['man', 'readi', 'doubl', 'need', 'prep', 'new']",20201208 0216200000,man readi doubl need prep new,6,0.0,0
2151,['market'],20201208 0215110000,market,1,0.0,0
2152,"['billion', 'valuat', 'trade', 'week']",20201208 0212560000,billion valuat trade week,4,0.0,0
2153,"['disgust', 'hope', 'horribl', 'compani', 'doesnt', 'respect', 'black', 'platform', 'white', 'money', 'aint', 'alway', 'right', 'money']",20201208 0206070000,disgust hope horribl compani doesnt respect black platform white money aint alway right money,14,-0.5505,0
2154,"['set', 'week', 'bullish', 'id', 'wait', 'retract', 'fall', 'due', 'profit', 'take', 'depend', 'lock', 'period', 'could', 'play', 'pump', 'morn', 'day', 'trade']",20201208 0204320000,set week bullish id wait retract fall due profit take depend lock period could play pump morn day trade,19,0.6486,-1
2155,['wait'],20201208 0150320000,wait,1,0.0,0
2156,"['week', 'definit']",20201208 0145110000,week definit,2,0.0,0
2157,"['use', 'hybrid', 'auction', 'u']",20201208 0142340000,use hybrid auction u,4,0.0,0
2158,"['pandem', 'pivot', 'kind', 'lodg', 'success', 'that', 'good', 'news']",20201208 0135410000,pandem pivot kind lodg success that good news,8,0.875,0
2159,"['normal', 'time', 'id', 'stock', 'go', 'public', 'right', 'much', 'uncertainti', 'length', 'feel', 'bullish', 'also', 'file', 'trigger', 'one']",20201208 0134230000,normal time id stock go public right much uncertainti length feel bullish also file trigger one,16,0.0,0
2160,"['financi', 'door', 'dash', 'via']",20201208 0128410000,financi door dash via,4,0.0,0
2161,"['financi', 'door', 'dash', 'via']",20201208 0128010000,financi door dash via,4,0.0,0
2162,"['exclus', 'technolog', 'market', 'hot', 'rais', 'price', 'news']",20201208 0121100000,exclus technolog market hot rais price news,7,0.0,0
2163,"['baromet', 'travel', 'pandem']",20201208 0120160000,baromet travel pandem,3,0.0,0
2164,"['dissect', 'strategi', 'base', 'prospectu', 'understand', 'linkag', 'strategi', 'valuat']",20201208 0115000000,dissect strategi base prospectu understand linkag strategi valuat,8,0.0,0
2165,"['financi', 'door', 'dash', 'via']",20201208 0110260000,financi door dash via,4,0.0,0
2166,"['seek', 'trade']",20201208 0108420000,seek trade,2,0.0,0
2167,"['ticker', 'share', 'price', 'ahead', 'sell', 'autonom', 'car', 'divis']",20201208 0107150000,ticker share price ahead sell autonom car divis,8,0.296,0
2168,"['verso', 'da']",20201208 0106390000,verso da,2,0.0,0
2169,"['boost', 'price', 'ahead', 'week']",20201208 0105020000,boost price ahead week,4,0.4019,0
2170,"['market', 'hot', 'rais', 'price']",20201208 0104400000,market hot rais price,4,0.0,0
2172,"['market', 'hot', 'rais', 'price', 'via']",20201208 0059360000,market hot rais price via,5,0.0,0
2173,"['go', 'futur', 'share', 'economi', 'dive', 'deep', 'tune', 'replay']",20201208 0056320000,go futur share economi dive deep tune replay,8,0.296,0
2174,"['fetch', 'roughli', 'billion', 'valuat']",20201208 0053020000,fetch roughli billion valuat,4,0.0,0
2175,"['market', 'hot', 'rais', 'price']",20201208 0052110000,market hot rais price,4,0.0,0
2176,"['price', 'target']",20201208 0051510000,price target,2,0.0,0
2177,"['stay', 'tune', 'come']",20201208 0051070000,stay tune come,3,0.0,0
2178,"['invest', 'gener', 'dont', 'recommend', 'sure', 'want', 'will', 'lose', 'equiti', 'way', 'employe', 'stock', 'compens', 'entir', 'differ', 'set']",20201208 0049340000,invest gener dont recommend sure want will lose equiti way employe stock compens entir differ set,16,-0.7179,-1
2179,['upcom'],20201208 0049320000,upcom,1,0.0,0
2180,"['agre', 'age', 'could', 'probabl', 'grab', 'decent', 'one', 'make', 'money', 'still', 'big', 'well']",20201208 0048530000,agre age could probabl grab decent one make money still big well,12,0.2732,1
2181,"['date', 'basic', 'gambl', 'way', 'individu', 'stock', 'gambl', 'even', 'there', 'price', 'histori', 'abil', 'understand', 'perform', 'public', 'market']",20201208 0048260000,date basic gambl way individu stock gambl even there price histori abil understand perform public market,16,0.0,0
2182,"['sera', 'sorti', 'en', 'march', 'un', 'plu']",20201208 0045190000,sera sorti en march un plu,6,0.0,0
2183,"['stock', 'next', 'big', 'stock', 'buy', 'via', 'stock']",20201208 0043100000,stock next big stock buy via stock,7,0.0,0
2184,"['share', 'rang']",20201208 0029230000,share rang,2,0.296,0
2185,"['de', 'e', 'us', 'em']",20201208 0028570000,de e us em,4,0.0,0
2186,['week'],20201208 0027480000,week,1,0.0,0
2187,"['lee', 'baromet', 'travel', 'pandem', 'batter', 'year', 'bet', 'chang', 'consum']",20201208 0027340000,lee baromet travel pandem batter year bet chang consum,9,0.0,0
2188,"['hot', 'price', 'rang', 'stock', 'trade', 'strategi']",20201208 0026510000,hot price rang stock trade strategi,6,0.0,0
2189,"['think', 'sell', 'work', 'would', 'go', 'find', 'cash']",20201208 0024390000,think sell work would go find cash,7,0.0,0
2190,"['share', 'rang']",20201208 0022050000,share rang,2,0.296,0
2191,"['anyon', 'stock', 'go', 'averag', 'time']",20201208 0021250000,anyon stock go averag time,5,0.0,0
2192,"['feel', 'either', 'also', 'go', 'public']",20201208 0017520000,feel either also go public,5,0.0,0
2193,"['fetch', 'roughli', 'billion', 'valuat']",20201208 0017460000,fetch roughli billion valuat,4,0.0,0
2194,"['market', 'recap', 'get', 'readi']",20201208 0012510000,market recap get readi,4,0.0,0
2195,"['right', 'hover', 'around', 'howev', 'bigger', 'impact', 'pandem', 'shift', 'mani', 'way']",20201208 0008430000,right hover around howev bigger impact pandem shift mani way,10,0.0,0
2196,"['share', 'price', 'ahead', 'week', 'rais', 'price', 'ahead', 'initi', 'public']",20201208 0008060000,share price ahead week rais price ahead initi public,9,0.296,0
2197,"['valuat', 'massiv', 'via', 'stake', 'link', 'profil']",20201208 0005430000,valuat massiv via stake link profil,6,0.0,0
2198,"['rais', 'price', 'ahead', 'week']",20201208 0004220000,rais price ahead week,4,0.0,0
2199,['rang'],20201209 2359530000,rang,1,0.0,0
2200,"['growth', 'stock', 'healthi', 'late', 'get', 'readi', 'big', 'news', 'adob', 'earn', 'possibl', 'vaccin', 'dash', 'snow']",20201209 2358240000,growth stock healthi late get readi big news adob earn possibl vaccin dash snow,14,0.3818,0
2201,"['said', 'price']",20201209 2358070000,said price,2,0.0,0
2203,"['said', 'price']",20201209 2356160000,said price,2,0.0,0
2204,"['wow', 'valuat', 'share', 'say']",20201209 2356030000,wow valuat share say,4,0.7184,0
2205,"['one', 'first', 'ventur', 'lucki', 'part']",20201209 2355340000,one first ventur lucki part,5,0.0,0
2206,"['said', 'price']",20201209 2355020000,said price,2,0.0,0
2207,"['price', 'apiec', 'accord', 'peopl', 'familiar', 'matter', 'latest', 'sign', 'exuber', 'market']",20201209 2354510000,price apiec accord peopl familiar matter latest sign exuber market,10,0.0258,0
2208,"['price', 'apiec', 'accord', 'peopl', 'familiar', 'matter', 'latest', 'sign', 'exuber', 'market']",20201209 2354380000,price apiec accord peopl familiar matter latest sign exuber market,10,0.0258,0
2209,"['price', 'compani', 'roughli']",20201209 2354370000,price compani roughli,3,0.0,0
2210,"['open', 'easili', 'worth', 'easi', 'money']",20201209 2354200000,open easili worth easi money,5,0.2263,0
2211,"['said', 'price']",20201209 2354020000,said price,2,0.0,0
2214,"['break', 'news', 'reportedli', 'price', 'initi', 'public', 'offer', 'per', 'share', 'rang', 'one', 'highli', 'public', 'wait', 'day', 'get']",20201209 2353030000,break news reportedli price initi public offer per share rang one highli public wait day get,16,0.296,-1
2215,"['might', 'tap']",20201209 2353000000,might tap,2,0.0,0
2216,"['break', 'price', 'share', 'peopl', 'familiar', 'matter', 'said', 'compani', 'billion']",20201209 2352440000,break price share peopl familiar matter said compani billion,9,0.3182,0
2217,"['joke', 'broke', 'bankrupt', 'cash', 'compani', 'cant', 'even', 'afford', 'advertis', 'holiday', 'travel', 'season', 'count', 'rais', 'get', 'cash', 'abl', 'advertis']",20201209 2352000000,joke broke bankrupt cash compani cant even afford advertis holiday travel season count rais get cash abl advertis,18,-0.3612,0
2218,"['said', 'reach', 'billion', 'valu']",20201209 2350150000,said reach billion valu,4,0.0258,0
2219,"['per', 'share', 'rais', 'billion']",20201209 2350040000,per share rais billion,4,0.296,0
2220,"['said', 'price']",20201209 2349490000,said price,2,0.0,0
2221,['tomorrow'],20201209 2349420000,tomorrow,1,0.0,0
2222,"['bring', 'like', 'dash']",20201209 2349250000,bring like dash,3,0.3612,0
2223,"['busi', 'insid', 'per', 'share', 'rais', 'billion']",20201209 2349160000,busi insid per share rais billion,6,0.296,0
2224,"['per', 'share', 'rais', 'billion', 'busi']",20201209 2348270000,per share rais billion busi,5,0.296,0
2225,"['share', 'sourc']",20201209 2348030000,share sourc,2,0.296,0
2226,"['price', 'versu', 'upwardli', 'rang', 'per', 'share', 'stock']",20201209 2347560000,price versu upwardli rang per share stock,7,0.296,0
2227,"['dont', 'buy', 'wait', 'til', 'price', 'competit', 'growth', 'year', 'due', 'covid', 'outsid', 'wont', 'sustain', 'much', 'better', 'go', 'long']",20201209 2347490000,dont buy wait til price competit growth year due covid outsid wont sustain much better go long,17,0.05,0
2228,"['per', 'share', 'rais', 'billion']",20201209 2347220000,per share rais billion,4,0.296,0
2229,"['rais', 'billion', 'begin', 'trade', 'symbol', 'stock']",20201209 2345450000,rais billion begin trade symbol stock,6,0.0,0
2230,"['said', 'price']",20201209 2345410000,said price,2,0.0,0
2231,"['said', 'price']",20201209 2344050000,said price,2,0.0,0
2232,"['said', 'price']",20201209 2342560000,said price,2,0.0,0
2233,"['price', 'rais']",20201209 2342270000,price rais,2,0.0,0
2234,"['price', 'either', 'per', 'share', 'hospit', 'unicorn', 'rais', 'price', 'target', 'week', 'anoth', 'snowflak', 'day']",20201209 2342040000,price either per share hospit unicorn rais price target week anoth snowflak day,13,0.296,0
2235,"['said', 'price']",20201209 2342000000,said price,2,0.0,0
2236,"['would', 'love', 'see', 'statist', 'around', 'odd', 'success', 'extra', 'dilut']",20201209 2341560000,would love see statist around odd success extra dilut,9,0.765,0
2237,"['ridicul', 'pandem', 'market', 'correct', 'littl', 'think', 'tomorrow']",20201209 2341560000,ridicul pandem market correct littl think tomorrow,7,0.0,0
2238,"['lean', 'toward', 'share']",20201209 2341480000,lean toward share,3,0.296,0
2239,"['news', 'exclus', 'lean', 'toward', 'share']",20201209 2341140000,news exclus lean toward share,5,0.296,0
2240,"['said', 'price']",20201209 2341050000,said price,2,0.0,0
2241,"['valu', 'billion']",20201209 2340350000,valu billion,2,0.0,0
2242,"['today', 'rais', 'billion', 'fulli', 'dilut', 'valuat', 'around', 'billion', 'begin', 'trade', 'tomorrow', 'new', 'york', 'stock', 'exchang', 'ticker', 'symbol']",20201209 2340250000,today rais billion fulli dilut valuat around billion begin trade tomorrow new york stock exchang ticker symbol,17,0.0,0
2243,['tomorrow'],20201209 2339500000,tomorrow,1,0.0,0
2244,"['market', 'stock']",20201209 2339110000,market stock,2,0.0,0
2245,"['de', 'en']",20201209 2338150000,de en,2,0.0,0
2246,"['may', 'pop', 'snow', 'year', 'go', 'insan', 'wish', 'direct', 'list']",20201209 2337560000,may pop snow year go insan wish direct list,9,0.4019,0
2247,"['sell', 'pressur', 'today', 'obviou', 'also', 'come', 'larg', 'flood', 'market', 'week', 'dash', 'ai', 'tradit', 'need', 'fund', 'new', 'paper', 'come', 'sell', 'index']",20201209 2337550000,sell pressur today obviou also come larg flood market week dash ai tradit need fund new paper come sell index,20,0.0,0
2248,"['said', 'price']",20201209 2337470000,said price,2,0.0,0
2249,"['said', 'price']",20201209 2337340000,said price,2,0.0,0
2250,"['said', 'price']",20201209 2337330000,said price,2,0.0,0
2251,"['said', 'price', 'price', 'either', 'per', 'share', 'hospit', 'unicorn', 'rais']",20201209 2337330000,said price price either per share hospit unicorn rais,9,0.296,0
2252,"['said', 'price', 'data', 'technolog', 'analyt']",20201209 2337330000,said price data technolog analyt,5,0.0,0
2253,"['good', 'chanc', 'tomorrow', 'ground', 'hog', 'day', 'price', 'much', 'higher', 'money', 'come', 'stock', 'today', 'buy', 'say']",20201209 2337290000,good chanc tomorrow ground hog day price much higher money come stock today buy say,15,0.4404,0
2254,"['said', 'price']",20201209 2337020000,said price,2,0.0,0
2255,"['said', 'price']",20201209 2337020000,said price,2,0.0,0
2256,"['valu', 'billion']",20201209 2336440000,valu billion,2,0.0,0
2257,"['said', 'price', 'price', 'either', 'per', 'share', 'hospit', 'unicorn', 'rais', 'price', 'target', 'week']",20201209 2336320000,said price price either per share hospit unicorn rais price target week,12,0.296,0
2258,"['said', 'price', 'tech', 'busi', 'money']",20201209 2336160000,said price tech busi money,5,0.0,0
2259,"['offici', 'price', 'upcom', 'per', 'share', 'accord']",20201209 2335490000,offici price upcom per share accord,6,0.296,1
2260,"['cap', 'busi', 'year']",20201209 2334460000,cap busi year,3,0.0,0
2261,"['said', 'price', 'via', 'news', 'popular']",20201209 2334360000,said price via news popular,5,0.4215,0
2262,"['el', 'de', 'la']",20201209 2334250000,el de la,3,0.0,0
2263,"['said', 'price']",20201209 2334160000,said price,2,0.0,0
2264,"['said', 'price']",20201209 2333220000,said price,2,0.0,0
2266,"['lean', 'toward', 'share', 'far', 'exceed', 'target', 'rang', 'share', 'compani', 'establish', 'week', 'peopl', 'familiar', 'matter', 'say']",20201209 2331190000,lean toward share far exceed target rang share compani establish week peopl familiar matter say,15,0.5423,0
2267,"['ye', 'ill', 'close', 'today', 'first', 'minut', 'went', 'origin', 'question', 'buy', 'question', 'maximum', 'accept', 'price']",20201209 2330550000,ye ill close today first minut went origin question buy question maximum accept price,14,-0.0516,0
2268,"['also', 'interest', 'look', 'tradit', 'averag', 'return', 'mean', 'basic', 'shut', 'pick', 'whatev', 'big', 'tomorrow', 'accord', 'ill', 'keep']",20201209 2328300000,also interest look tradit averag return mean basic shut pick whatev big tomorrow accord ill keep,16,0.0516,0
2269,"['key', 'know']",20201209 2327190000,key know,2,0.0,0
2270,"['head', 'pst', 'tune', 'new', 'sift', 'find', 'valu', 'tune', 'dash']",20201209 2325480000,head pst tune new sift find valu tune dash,9,0.0,0
2271,"['exchang', 'deriv', 'contract', 'ahead', 'avail', 'read']",20201209 2325020000,exchang deriv contract ahead avail read,6,0.0,0
2272,"['think', 'could', 'buy', 'hold']",20201209 2320290000,think could buy hold,4,0.0,0
2274,"['data', 'china', 'move', 'forward']",20201209 2314280000,data china move forward,4,0.0,0
2275,"['total', 'dude', 'billion', 'tomorrow']",20201209 2313440000,total dude billion tomorrow,4,0.0,0
2276,"['set', 'big', 'one', 'potenti', 'obstacl', 'success', 'angri']",20201209 2312440000,set big one potenti obstacl success angri,7,0.5719,0
2277,"['warn', 'unhappi', 'fight', 'back']",20201209 2312400000,warn unhappi fight back,4,-0.4588,0
2278,"['lean', 'toward', 'share', 'say']",20201209 2311380000,lean toward share say,4,0.296,0
2279,"['research', 'gon', 'na', 'interest']",20201209 2311220000,research gon na interest,4,0.4588,0
2280,"['lean', 'toward', 'set', 'price', 'apiec', 'accord', 'peopl', 'familiar', 'matter', 'latest', 'sign', 'exuber', 'market']",20201209 2310320000,lean toward set price apiec accord peopl familiar matter latest sign exuber market,13,0.0258,0
2281,"['un', 'para', 'de', 'en', 'el', 'de', 'en', 'el', 'de', 'el', 'con', 'el', 'de']",20201209 2310020000,un para de en el de en el de el con el de,13,0.0,0
2282,"['went', 'live', 'yesterday', 'realli', 'interest', 'move', 'anyon', 'know', 'first', 'offer', 'major', 'find', 'anyth', 'quick']",20201209 2308270000,went live yesterday realli interest move anyon know first offer major find anyth quick,14,0.4588,0
2283,"['stock', 'interest', 'go', 'travel', 'probabl', 'continu', 'grow', 'bullish', 'stock', 'final', 'go', 'public', 'wait', 'entir', 'year']",20201209 2308200000,stock interest go travel probabl continu grow bullish stock final go public wait entir year,15,0.4588,0
2284,"['price', 'previous', 'forecast', 'rang', 'report', 'traffic', 'transport', 'ship', 'truck', 'news']",20201209 2307290000,price previous forecast rang report traffic transport ship truck news,10,0.0,0
2285,"['reportedli', 'toward', 'upcom', 'per', 'share', 'last', 'target', 'price', 'rang', 'accord']",20201209 2307270000,reportedli toward upcom per share last target price rang accord,10,0.296,0
2286,"['lean', 'toward', 'set', 'price', 'apiec', 'latest', 'sign', 'exuber', 'market', 'price', 'far', 'target', 'rang', 'share', 'establish', 'week', 'rang', 'clamor']",20201209 2307070000,lean toward set price apiec latest sign exuber market price far target rang share establish week rang clamor,18,0.296,0
2287,"['set', 'big', 'one', 'potenti', 'obstacl', 'via']",20201209 2306240000,set big one potenti obstacl via,6,0.0,0
2288,['sweet'],20201209 2302090000,sweet,1,0.4588,0
2289,"['lean', 'toward', 'share']",20201209 2301480000,lean toward share,3,0.296,0
2291,['portfolio'],20201209 2246220000,portfolio,1,0.0,0
2292,"['easi', 'peasi', 'good', 'one', 'catch', 'x']",20201209 2245370000,easi peasi good one catch x,6,0.4404,0
2293,"['still', 'look', 'get', 'trade', 'stock', 'dash', 'get', 'becom', 'client', 'make', 'net']",20201209 2244000000,still look get trade stock dash get becom client make net,11,0.0,0
2294,"['didnt', 'realiz', 'dash', 'use', 'hybrid', 'approach', 'use', 'hybrid', 'auction', 'via']",20201209 2241400000,didnt realiz dash use hybrid approach use hybrid auction via,10,0.0,0
2295,"['radar', 'account', 'stabl', 'way', 'green', 'red', 'day', 'heart', 'take', 'drama', 'that', 'sure', 'come']",20201209 2237070000,radar account stabl way green red day heart take drama that sure come,13,0.7579,0
2296,"['get', 'readi', 'list', 'exchang', 'mark', 'one', 'keenli', 'us', 'share', 'remark', 'turnaround', 'guest', 'accommod', 'compani']",20201209 2236070000,get readi list exchang mark one keenli us share remark turnaround guest accommod compani,14,0.296,0
2297,"['lot', 'excit', 'one', 'simpl', 'reason', 'thank', 'covid', 'peak', 'year', 'food', 'deliveri', 'like', 'dash', 'wherea', 'worst', 'year', 'essenti', 'vote', 'confid', 'econom', 'recoveri']",20201209 2235560000,lot excit one simpl reason thank covid peak year food deliveri like dash wherea worst year essenti vote confid econom recoveri,21,-0.0258,0
2298,"['p', 'tallet', 'men', 'om', 'er', 'p', 'den', 'til', 'se', 'morgen', 'en', 'rang', 'p', 'p', 'gen', 'z']",20201209 2234170000,p tallet men om er p den til se morgen en rang p p gen z,16,0.0,0
2299,"['yep', 'similar', 'given', 'eventu', 'size']",20201209 2231200000,yep similar given eventu size,5,0.296,0
2300,"['given', 'much', 'tomorrow', 'take', 'growth', 'strategi', 'focu', 'brand', 'strategi', 'short', 'read']",20201209 2221050000,given much tomorrow take growth strategi focu brand strategi short read,11,0.3818,0
2301,"['unvest', 'stock', 'first', 'nine', 'year', 'reveal']",20201209 2215110000,unvest stock first nine year reveal,6,0.0,0
2302,"['show', 'like', 'door', 'dash']",20201209 2208200000,show like door dash,4,0.3612,0
2303,"['dont', 'show', 'launch', 'good', 'chanc', 'declin', 'initi', 'profit', 'burn', 'cash', 'sinc', 'due', 'suppos', 'wont', 'let', 'trade', 'uncertainti', 'better', 'avoid']",20201209 2208120000,dont show launch good chanc declin initi profit burn cash sinc due suppos wont let trade uncertainti better avoid,19,0.2946,0
2304,"['un', 'exchang', 'de', 'de', 'de', 'en', 'la', 'de', 'la', 'de', 'en']",20201209 2205100000,un exchang de de de en la de la de en,11,0.0,0
2305,"['trade', 'within', 'month', 'eat', 'shoe']",20201209 2202050000,trade within month eat shoe,5,0.0,0
2306,"['lead', 'big', 'peter', 'could', 'winner']",20201209 2200190000,lead big peter could winner,5,0.5859,0
2307,"['key', 'major', 'global', 'support', 'growth', 'trajectori', 'next', 'decad', 'beyond', 'travel']",20201209 2159010000,key major global support growth trajectori next decad beyond travel,10,0.7043,0
2308,"['bit', 'sinc', 'incept', 'gone', 'public', 'prior', 'number', 'doubl', 'tomorrow']",20201209 2158540000,bit sinc incept gone public prior number doubl tomorrow,9,0.0772,0
2309,"['tomorrow', 'stock', 'next', 'day', 'short', 'fun', 'could', 'great', 'invest', 'huge', 'potenti', 'pandem', 'well', 'see', 'buy', 'hold']",20201209 2157300000,tomorrow stock next day short fun could great invest huge potenti pandem well see buy hold,16,0.8957,0
2310,"['probabl', 'sign', 'go', 'huge', 'valuat', 'tomorrow', 'suspect', 'expens', 'chase']",20201209 2154530000,probabl sign go huge valuat tomorrow suspect expens chase,9,0.0258,0
2311,"['break', 'stock', 'reportedli', 'price', 'price', 'share', 'rang', 'price', 'initi', 'public', 'offer', 'recent', 'target', 'rang', 'report', 'san']",20201209 2152230000,break stock reportedli price price share rang price initi public offer recent target rang report san,16,0.296,0
2312,"['felt', 'like', 'tech', 'piggi', 'bank', 'today', 'silli', 'tomorrow']",20201209 2151170000,felt like tech piggi bank today silli tomorrow,8,0.3612,0
2313,"['set', 'big', 'one', 'potenti', 'obstacl', 'via']",20201209 2149330000,set big one potenti obstacl via,6,0.0,0
2314,"['set', 'big', 'one', 'potenti', 'obstacl', 'via']",20201209 2148430000,set big one potenti obstacl via,6,0.0,0
2315,"['market', 'pop', 'realli', 'worth', 'dash', 'hope', 'activ', 'push', 'better']",20201209 2144550000,market pop realli worth dash hope activ push better,9,0.7717,0
2316,"['make', 'ahead', 'model', 'free', 'analyz']",20201209 2144100000,make ahead model free analyz,5,0.5106,0
2317,"['guid', 'youv', 'got', 'make', 'move', 'rush', 'mad', 'money', 'host', 'said', 'day', 'target', 'rang', 'goe', 'public', 'yo']",20201209 2136510000,guid youv got make move rush mad money host said day target rang goe public yo,16,-0.4939,0
2318,"['see', 'bag', 'hold', 'dash', 'market', 'number', 'tomorrow']",20201209 2136130000,see bag hold dash market number tomorrow,7,0.0772,0
2319,['tomorrow'],20201209 2135330000,tomorrow,1,0.0,0
2320,"['ye', 'paper', 'money', 'turn', 'real', 'money', 'tax', 'man', 'like', 'calculu']",20201209 2134020000,ye paper money turn real money tax man like calculu,10,0.3612,0
2321,"['key', 'know']",20201209 2133380000,key know,2,0.0,0
