,content,date,text,Length,sid_sentiment,finbert_label
3340,"['find', 'look', 'attract', 'upcom']",20190507 1701010000,find look attract upcom,4,0.3612,0
3341,"['may', 'strike', 'ahead', 'dont', 'scab', 'call', 'mayb', 'give', 'ride', 'pleas', 'share']",20190507 1700370000,may strike ahead dont scab call mayb give ride pleas share,11,0.1779,0
3342,"['strike', 'set', 'cast', 'shadow']",20190507 1700320000,strike set cast shadow,4,-0.128,-1
3343,"['treat', 'us', 'like', 'crap', 'feel', 'poor', 'powerless', 'eve']",20190507 1658120000,treat us like crap feel poor powerless eve,8,-0.5719,-1
3344,"['new', 'drive', 'away', 'platform', 'run']",20190507 1657380000,new drive away platform run,5,0.0,0
3345,"['go', 'strike', 'pay', 'ahead', 'billion']",20190507 1650500000,go strike pay ahead billion,5,-0.2263,0
3346,"['stage', 'massiv', 'strike']",20190507 1650110000,stage massiv strike,3,-0.128,0
3347,"['tomorrow', 'work', 'stoppag', 'make', 'thing', 'interest']",20190507 1649440000,tomorrow work stoppag make thing interest,6,0.4588,0
3348,"['wait', 'like']",20190507 1649440000,wait like,2,0.3612,0
3350,"['sorri', 'luck', 'nervou', 'particular', 'articl', 'technolog', 'may']",20190507 1648380000,sorri luck nervou particular articl technolog may,7,0.4588,0
3351,"['wont', 'chang', 'swashbuckl', 'behavior']",20190507 1647590000,wont chang swashbuckl behavior,4,0.0,0
3353,"['curiou', 'upcom', 'listen', 'updat', 'outlin', 'three', 'import', 'know']",20190507 1645120000,curiou upcom listen updat outlin three import know,8,0.0,0
3354,"['stand', 'go', 'strike', 'may', 'ahead', 'think', 'care', 'travel']",20190507 1644280000,stand go strike may ahead think care travel,8,0.4019,0
3355,"['lot', 'action', 'tech', 'sector', 'right', 'look', 'forward', 'today', 'could', 'talk', 'earn', 'di', 'find']",20190507 1642490000,lot action tech sector right look forward today could talk earn di find,13,0.0,0
3356,"['year', 'us', 'tech', 'exit', 'valu', 'like', 'go']",20190507 1642350000,year us tech exit valu like go,7,0.3612,0
3357,"['se', 'de']",20190507 1641090000,se de,2,0.0,0
3358,"['se', 'de']",20190507 1640180000,se de,2,0.0,0
3359,"['treat', 'us', 'like', 'crap', 'feel', 'poor', 'powerless', 'eve', 'may', 'syndic', 'taxi', 'news', 'focu']",20190507 1638110000,treat us like crap feel poor powerless eve may syndic taxi news focu,13,-0.5719,0
3360,"['plan', 'strike', 'ralli', 'ahead']",20190507 1637370000,plan strike ralli ahead,4,-0.128,0
3361,"['right', 'mind', 'would', 'invest', 'compani']",20190507 1635040000,right mind would invest compani,5,0.0,0
3362,"['theori', 'next', 'major', 'like', 'march', 'caus', 'declin', 'shortli', 'scrutini', 'short', 'play']",20190507 1635030000,theori next major like march caus declin shortli scrutini short play,11,0.6361,0
3363,"['strike', 'protest', 'upcom']",20190507 1634440000,strike protest upcom,3,-0.3612,-1
3364,"['treat', 'us', 'like', 'crap', 'feel', 'poor', 'powerless', 'eve', 'news', 'busi', 'free']",20190507 1634410000,treat us like crap feel poor powerless eve news busi free,11,-0.1027,0
3365,"['week', 'either', 'way', 'must', 'read', 'intent', 'network', 'effect']",20190507 1633190000,week either way must read intent network effect,8,0.0,0
3366,"['what', 'what']",20190507 1631210000,what what,2,0.0,0
3367,"['dont', 'let', 'take', 'ride', 'via']",20190507 1631170000,dont let take ride via,5,0.0,0
3368,"['us', 'plan', 'shutdown', 'pay', 'put', 'million', 'core', 'servic', 'compani', 'get', 'noth', 'capit']",20190507 1630400000,us plan shutdown pay put million core servic compani get noth capit,12,-0.1027,0
3369,"['may', 'stumbl', 'like', 'even', 'recent']",20190507 1627510000,may stumbl like even recent,5,0.3612,0
3370,"['treat', 'us', 'like', 'crap', 'feel', 'poor', 'powerless', 'eve']",20190507 1627470000,treat us like crap feel poor powerless eve,8,-0.5719,-1
3371,"['tactic', 'pursuit', 'growth', 'cofound', 'former', 'travi', 'use', 'tell', 'keep', 'compani', 'order', 'chao']",20190507 1625320000,tactic pursuit growth cofound former travi use tell keep compani order chao,12,0.3818,0
3372,"['treat', 'us', 'like', 'crap', 'feel', 'poor', 'powerless', 'eve', 'technolog', 'guardian']",20190507 1624590000,treat us like crap feel poor powerless eve technolog guardian,10,-0.5719,0
3373,['news'],20190507 1624380000,news,1,0.0,0
3374,"['watch', 'think', 'good', 'chanc', 'publish', 'stake']",20190507 1623570000,watch think good chanc publish stake,6,0.4404,0
3375,"['plan', 'strike', 'day', 'labor', 'greed', 'famili']",20190507 1623170000,plan strike day labor greed famili,6,-0.4939,0
3376,"['plan', 'strike', 'ahead', 'need', 'white', 'folk', 'strike', 'serious']",20190507 1622010000,plan strike ahead need white folk strike serious,8,-0.3182,0
3377,"['howev', 'also', 'fear', 'earli', 'overal', 'tech', 'market', 'short', 'juici', 'come', 'like', 'cours', 'vision', 'fund']",20190507 1621370000,howev also fear earli overal tech market short juici come like cours vision fund,14,0.0772,0
3378,"['sorri', 'luck', 'nervou', 'particular']",20190507 1621120000,sorri luck nervou particular,4,0.4588,0
3379,"['tactic', 'pursuit']",20190507 1620570000,tactic pursuit,2,0.0,0
3380,"['treat', 'us', 'like', 'crap', 'feel', 'poor', 'powerless', 'eve']",20190507 1620210000,treat us like crap feel poor powerless eve,8,-0.5719,-1
3381,"['use', 'strike', 'ahead']",20190507 1619100000,use strike ahead,3,-0.128,0
3382,"['strike', 'protest', 'upcom']",20190507 1618440000,strike protest upcom,3,-0.3612,-1
3383,"['fast', 'compani', 'cocreat', 'strike', 'protest', 'upcom']",20190507 1618330000,fast compani cocreat strike protest upcom,6,-0.3612,-1
3384,"['may', 'stumbl', 'like', 'even', 'recent']",20190507 1618060000,may stumbl like even recent,5,0.3612,0
3385,"['strike', 'protest', 'upcom']",20190507 1618020000,strike protest upcom,3,-0.3612,-1
3386,"['strike', 'young', 'buck', 'rant', 'cent', 'hold', 'back', 'via']",20190507 1618020000,strike young buck rant cent hold back via,8,-0.4404,0
3387,"['plan', 'strike', 'ralli', 'ahead']",20190507 1617000000,plan strike ralli ahead,4,-0.128,0
3388,"['set', 'strike', 'across', 'sever', 'major', 'go', 'public', 'week', 'one', 'biggest', 'ever', 'sourc']",20190507 1615260000,set strike across sever major go public week one biggest ever sourc,12,-0.128,-1
3389,"['strike', 'ahead', 'billion']",20190507 1615070000,strike ahead billion,3,-0.128,0
3390,"['strike', 'protest', 'upcom', 'via']",20190507 1613150000,strike protest upcom via,4,-0.3612,-1
3391,"['busi', 'earn', 'two', 'alway', 'work', 'hand', 'hand', 'certainli', 'dont', 'act', 'true', 'wouldnt', 'trust', 'earn', 'look', 'better', 'ploy', 'pump', 'coincid']",20190507 1613130000,busi earn two alway work hand hand certainli dont act true wouldnt trust earn look better ploy pump coincid,19,0.6447,0
3392,"['strike', 'protest', 'upcom', 'fast', 'coexist']",20190507 1613100000,strike protest upcom fast coexist,5,-0.3612,0
3393,"['strike', 'protest', 'upcom']",20190507 1612160000,strike protest upcom,3,-0.3612,-1
3394,"['strike', 'protest', 'upcom']",20190507 1612040000,strike protest upcom,3,-0.3612,-1
3395,['yet'],20190507 1611270000,yet,1,0.0,0
3396,"['could', 'one', 'time', 'overblown', 'good', 'deal']",20190507 1610060000,could one time overblown good deal,6,0.4404,0
3397,"['strike', 'protest', 'upcom']",20190507 1609350000,strike protest upcom,3,-0.3612,-1
3398,"['go', 'strike', 'ahead', 'billion']",20190507 1608330000,go strike ahead billion,4,-0.128,0
3399,"['go', 'strike', 'pay', 'ahead', 'billion']",20190507 1607450000,go strike pay ahead billion,5,-0.2263,0
3400,"['strike', 'protest', 'upcom', 'impact']",20190507 1606340000,strike protest upcom impact,4,-0.3612,-1
3401,"['strike', 'protest', 'upcom']",20190507 1606330000,strike protest upcom,3,-0.3612,-1
3402,"['driver', 'rape', 'woman']",20190507 1606190000,driver rape woman,3,-0.6908,-1
3403,"['strike', 'protest', 'upcom']",20190507 1606050000,strike protest upcom,3,-0.3612,-1
3404,"['strike', 'protest', 'upcom', 'impact']",20190507 1606040000,strike protest upcom impact,4,-0.3612,-1
3405,"['strike', 'protest', 'upcom']",20190507 1606030000,strike protest upcom,3,-0.3612,-1
3406,"['strike', 'protest', 'upcom']",20190507 1606030000,strike protest upcom,3,-0.3612,-1
3407,"['strike', 'protest', 'upcom']",20190507 1606030000,strike protest upcom,3,-0.3612,-1
3408,"['base', 'two', 'done', 'late', 'might', 'better', 'pitch', 'deliveri', 'servic', 'food', 'oppos', 'compani', 'point', 'point', 'b']",20190507 1605010000,base two done late might better pitch deliveri servic food oppos compani point point b,15,0.4404,0
3409,['guid'],20190507 1604490000,guid,1,0.0,0
3410,"['busi', 'trend', 'know', 'that', 'need', 'cash', 'leav', 'buy', 'hold', 'bag', 'swiss', 'court', 'driver', 'employe']",20190507 1604380000,busi trend know that need cash leav buy hold bag swiss court driver employe,14,0.0,0
3411,['expect'],20190507 1604330000,expect,1,0.0,0
3413,"['say', 'personnel', 'today']",20190507 1604140000,say personnel today,3,0.0,0
3414,"['taxi', 'rival', 'cost', 'transport', 'technolog', 'market', 'busi', 'entrepreneur', 'news']",20190507 1604010000,taxi rival cost transport technolog market busi entrepreneur news,9,0.0,0
3415,"['impend', 'overblown', 'good', 'deal', 'weigh']",20190507 1603510000,impend overblown good deal weigh,5,0.4404,0
3416,"['averag', 'per', 'ride', 'readi', 'go', 'public', 'news']",20190507 1603250000,averag per ride readi go public news,7,0.0,0
3417,"['mon', 'analys']",20190507 1602110000,mon analys,2,0.0,0
3418,"['de', 'de', 'el', 'de', 'de', 'baba', 'de', 'buy', 'stop', 'buy', 'limit']",20190507 1601410000,de de el de de baba de buy stop buy limit,11,-0.296,0
3419,"['strike', 'least', 'us', 'around', 'world', 'tomorrow', 'work', 'wage', 'strike', 'may', 'via']",20190507 1601410000,strike least us around world tomorrow work wage strike may via,11,-0.25,-1
3420,"['may', 'stumbl', 'like', 'even', 'recent', 'soar']",20190507 1601070000,may stumbl like even recent soar,6,0.3612,0
3421,"['treat', 'us', 'like', 'crap', 'feel', 'poor', 'powerless', 'eve']",20190507 1601010000,treat us like crap feel poor powerless eve,8,-0.5719,-1
3422,"['strike', 'ahead']",20190507 1600550000,strike ahead,2,-0.128,-1
3423,"['plan', 'global', 'strike', 'honor']",20190507 1559300000,plan global strike honor,4,0.4019,0
3424,['decod'],20190507 1559200000,decod,1,0.0,0
3425,['decod'],20190507 1558530000,decod,1,0.0,0
3426,"['strike', 'ralli', 'time', 'ahead', 'impend']",20190507 1558400000,strike ralli time ahead impend,5,-0.128,0
3427,"['plan', 'strike', 'ralli', 'ahead']",20190507 1558140000,plan strike ralli ahead,4,-0.128,0
3428,"['new', 'set', 'strike', 'ralli', 'ahead']",20190507 1557340000,new set strike ralli ahead,5,-0.128,0
3429,"['strike', 'set', 'cast', 'shadow', 'via']",20190507 1556330000,strike set cast shadow via,5,-0.128,-1
3430,"['strike', 'set', 'cast', 'shadow']",20190507 1556330000,strike set cast shadow,4,-0.128,-1
3431,"['go', 'strike', 'pay', 'ahead', 'billion']",20190507 1555280000,go strike pay ahead billion,5,-0.2263,0
3432,"['strike', 'set', 'cast', 'shadow']",20190507 1555090000,strike set cast shadow,4,-0.128,-1
3433,"['former', 'tech', 'cofound', 'give', 'tech', 'pass', 'financi', 'last', 'time', 'saw', 'analysi']",20190507 1554480000,former tech cofound give tech pass financi last time saw analysi,11,0.0,0
3434,"['chair', 'investor', 'watch', 'gross', 'mark', 'key', 'metric', 'convers']",20190507 1554480000,chair investor watch gross mark key metric convers,8,-0.4767,0
3435,"['market', 'enter', 'week', 'sinc', 'least', 'set', 'price', 'led', 'biggest', 'sinc', 'five', 'ago', 'see', 'via']",20190507 1554120000,market enter week sinc least set price led biggest sinc five ago see via,14,0.0,1
3436,"['unicorn', 'red', 'hot', 'late', 'beyond', 'meat', 'zoom', 'much', 'could', 'bad', 'news', 'coke', 'stori']",20190507 1552330000,unicorn red hot late beyond meat zoom much could bad news coke stori,13,-0.5423,0
3437,"['la', 'ce', 'la']",20190507 1552220000,la ce la,3,0.0,0
3438,"['beer', 'via']",20190507 1552170000,beer via,2,0.0,0
3439,"['citi', 'gone', 'path', 'public', 'transit', 'strateg', 'plan', 'via', 'loss', 'work']",20190507 1551590000,citi gone path public transit strateg plan via loss work,10,-0.3182,0
3440,"['quot', 'day', 'doesnt', 'look', 'like', 'sens', 'gener', 'doesnt', 'make', 'sens', 'aka', 'busi', 'path', 'profit', 'yet', 'premium', 'right']",20190507 1551090000,quot day doesnt look like sens gener doesnt make sens aka busi path profit yet premium right,17,0.1999,0
3441,"['dont', 'judg', 'either']",20190507 1550510000,dont judg either,3,0.0,0
3442,"['treat', 'us', 'like', 'crap', 'feel', 'poor', 'powerless', 'eve']",20190507 1550040000,treat us like crap feel poor powerless eve,8,-0.5719,-1
3443,"['strike', 'ralli', 'ahead']",20190507 1550030000,strike ralli ahead,3,-0.128,0
3444,"['throw', 'hail', 'mari', 'need', 'catch', 'group', 'inspir', 'global', 'strike', 'urgent', 'need', 'fund', 'ask', 'join']",20190507 1549450000,throw hail mari need catch group inspir global strike urgent need fund ask join,14,0.4215,0
3445,"['faro', 'data']",20190507 1547390000,faro data,2,0.0,0
3446,"['could', 'reap', 'stun', 'return', 'zero', 'hedg']",20190507 1547050000,could reap stun return zero hedg,6,0.0,0
3447,"['us', 'strike', 'ahead']",20190507 1546480000,us strike ahead,3,-0.128,0
3448,['big'],20190507 1545470000,big,1,0.0,0
3449,"['plan', 'strike', 'ralli', 'ahead']",20190507 1545460000,plan strike ralli ahead,4,-0.128,0
3450,"['plan', 'celebr', 'file', 'strike', 'tomorrow', 'via']",20190507 1544010000,plan celebr file strike tomorrow via,6,-0.128,-1
3451,"['put', 'money', 'tell', 'deserv', 'lose', 'everi', 'dime', 'stand', 'damn', 'good', 'hous', 'fool', 'see']",20190507 1543120000,put money tell deserv lose everi dime stand damn good hous fool see,13,-0.6597,0
3452,"['strike', 'ahead']",20190507 1541550000,strike ahead,2,-0.128,-1
3453,"['treat', 'us', 'like', 'crap', 'feel', 'poor', 'powerless', 'eve']",20190507 1541510000,treat us like crap feel poor powerless eve,8,-0.5719,-1
3454,"['good', 'go', 'strike', 'one', 'day']",20190507 1541210000,good go strike one day,5,0.34,0
3455,"['strike', 'tomorrow', 'may', 'strike', 'key', 'success', 'lack', 'platform']",20190507 1540320000,strike tomorrow may strike key success lack platform,8,0.1027,-1
3456,"['treat', 'us', 'like', 'crap', 'feel', 'poor', 'powerless', 'eve']",20190507 1539300000,treat us like crap feel poor powerless eve,8,-0.5719,-1
3457,"['realli', 'feel', 'concern', 'taxi', 'treat', 'us', 'like', 'crap', 'feel', 'poor', 'powerless', 'eve']",20190507 1536270000,realli feel concern taxi treat us like crap feel poor powerless eve,12,-0.5719,-1
3458,"['feel', 'poor', 'powerless', 'eve']",20190507 1535040000,feel poor powerless eve,4,-0.743,-1
3459,"['strike', 'ahead']",20190507 1535020000,strike ahead,2,-0.128,-1
3460,"['alert', 'may']",20190507 1534390000,alert may,2,0.296,0
3461,"['strike', 'ahead', 'billion']",20190507 1534370000,strike ahead billion,3,-0.128,0
3462,"['biggest', 'list', 'anticip', 'ahead']",20190507 1534340000,biggest list anticip ahead,4,0.0,0
3463,"['realiti', 'tha', 'nice', 'get', 'incom', 'must', 'job', 'crazi', 'decid', 'live', 'treat', 'us', 'like', 'crap', 'feel', 'poor', 'powerless', 'eve']",20190507 1534310000,realiti tha nice get incom must job crazi decid live treat us like crap feel poor powerless eve,18,-0.2263,-1
3464,"['plan', 'global', 'strike', 'honor']",20190507 1534230000,plan global strike honor,4,0.4019,0
3465,"['treat', 'us', 'like', 'crap', 'feel', 'poor', 'powerless', 'eve']",20190507 1534140000,treat us like crap feel poor powerless eve,8,-0.5719,-1
3466,"['think', 'current', 'trade', 'grey', 'market', 'launch', 'may']",20190507 1533530000,think current trade grey market launch may,7,0.0516,0
3467,"['week', 'tomorrow', 'threaten']",20190507 1533040000,week tomorrow threaten,3,-0.3818,0
3468,"['could', 'obtain', 'return']",20190507 1531190000,could obtain return,3,0.0,0
3469,"['biggest', 'pop', 'also', 'savvi', 'big', 'singl', 'also', 'hot', 'real', 'hidden', 'away', 'piec', 'fact', 'privat', 'show']",20190507 1530380000,biggest pop also savvi big singl also hot real hidden away piec fact privat show,15,0.0,0
3470,"['alert', 'may']",20190507 1529300000,alert may,2,0.296,0
3471,"['strike', 'ahead']",20190507 1529300000,strike ahead,2,-0.128,-1
3472,"['treat', 'us', 'like', 'crap', 'feel', 'poor', 'powerless', 'eve']",20190507 1528580000,treat us like crap feel poor powerless eve,8,-0.5719,-1
3473,"['tactic', 'pursuit']",20190507 1528400000,tactic pursuit,2,0.0,0
3474,"['treat', 'us', 'like', 'crap', 'feel', 'poor', 'powerless', 'eve']",20190507 1528150000,treat us like crap feel poor powerless eve,8,-0.5719,-1
3475,"['treat', 'us', 'like', 'crap', 'feel', 'poor', 'powerless', 'eve']",20190507 1528140000,treat us like crap feel poor powerless eve,8,-0.5719,-1
3476,"['treat', 'us', 'like', 'crap', 'feel', 'poor', 'powerless', 'eve']",20190507 1526370000,treat us like crap feel poor powerless eve,8,-0.5719,-1
3477,"['treat', 'us', 'like', 'crap', 'feel', 'poor', 'powerless', 'eve', 'wage', 'inadequ', 'mean', 'left', 'behind', 'firm', 'stock', 'market', 'debut', 'via']",20190507 1526310000,treat us like crap feel poor powerless eve wage inadequ mean left behind firm stock market debut via,18,-0.5719,-1
3478,"['go', 'strike', 'pay', 'ahead', 'billion', 'pay', 'littl', 'unfairli', 'avoid', 'offer', 'addit', 'instead']",20190507 1526240000,go strike pay ahead billion pay littl unfairli avoid offer addit instead,12,-0.5423,0
3479,"['go', 'strike']",20190507 1525270000,go strike,2,-0.128,0
3480,"['huge', 'week', 'come', 'later', 'week', 'compani', 'face', 'pressur', 'wall', 'street', 'cut', 'driver', 'strike', 'ahead', 'fight', 'better', 'wage']",20190507 1524440000,huge week come later week compani face pressur wall street cut driver strike ahead fight better wage,17,-0.0,1
3481,"['huge', 'week', 'come', 'later', 'week', 'compani', 'face', 'pressur', 'wall', 'street', 'cut', 'driver', 'strike', 'ahead', 'fight', 'better', 'wage']",20190507 1524300000,huge week come later week compani face pressur wall street cut driver strike ahead fight better wage,17,-0.0,1
3482,"['treat', 'us', 'like', 'crap', 'feel', 'poor', 'powerless', 'eve', 'via']",20190507 1524260000,treat us like crap feel poor powerless eve via,9,-0.5719,-1
3483,"['treat', 'us', 'like', 'crap', 'feel', 'poor', 'powerless', 'eve']",20190507 1520330000,treat us like crap feel poor powerless eve,8,-0.5719,-1
3484,"['go', 'strike', 'pay', 'ahead', 'billion']",20190507 1520100000,go strike pay ahead billion,5,-0.2263,0
3485,"['dip', 'bless', 'grab', 'one', 'big', 'build']",20190507 1519550000,dip bless grab one big build,6,0.4215,0
3486,"['look', 'treat', 'us', 'like', 'crap', 'feel', 'poor', 'powerless', 'eve', 'via', 'investor']",20190507 1519300000,look treat us like crap feel poor powerless eve via investor,11,-0.5719,0
3487,"['busi', 'career', 'treat', 'us', 'like', 'crap', 'feel', 'poor', 'powerless', 'eve', 'via']",20190507 1519250000,busi career treat us like crap feel poor powerless eve via,11,-0.5719,-1
3488,"['treat', 'us', 'like', 'crap', 'feel', 'poor', 'powerless', 'eve']",20190507 1517240000,treat us like crap feel poor powerless eve,8,-0.5719,-1
3489,"['plan', 'global', 'strike', 'honor', 'via']",20190507 1516380000,plan global strike honor via,5,0.4019,0
3490,"['treat', 'us', 'like', 'crap', 'feel', 'poor', 'powerless', 'eve']",20190507 1516000000,treat us like crap feel poor powerless eve,8,-0.5719,-1
3491,"['tactic', 'pursuit']",20190507 1514330000,tactic pursuit,2,0.0,0
3492,"['price', 'rang', 'fallen', 'sinc', 'initi', 'demand', 'still', 'lower', 'end', 'rang', 'could', 'stock', 'face', 'pressur', 'soon', 'tomorrow', 'find']",20190507 1513500000,price rang fallen sinc initi demand still lower end rang could stock face pressur soon tomorrow find,17,-0.6369,-1
3493,"['water', 'deal', 'side', 'win', 'global', 'ralli', 'time', 'blow', 'top']",20190507 1512470000,water deal side win global ralli time blow top,9,0.6808,0
3494,"['treat', 'us', 'like', 'crap', 'feel', 'poor', 'powerless', 'eve']",20190507 1512170000,treat us like crap feel poor powerless eve,8,-0.5719,-1
3495,"['go', 'strike', 'day']",20190507 1511530000,go strike day,3,-0.128,0
3496,"['tactic', 'pursuit', 'growth']",20190507 1509580000,tactic pursuit growth,3,0.3818,0
3497,"['go', 'strike', 'pay', 'ahead', 'billion']",20190507 1508230000,go strike pay ahead billion,5,-0.2263,0
3498,"['feel', 'poor', 'powerless', 'eve']",20190507 1507410000,feel poor powerless eve,4,-0.743,-1
3499,"['global', 'strike', 'ahead']",20190507 1507400000,global strike ahead,3,-0.128,0
3500,"['go', 'strike', 'pay', 'ahead', 'billion']",20190507 1507320000,go strike pay ahead billion,5,-0.2263,0
3501,"['potenti', 'road', 'show', 'team', 'look', 'today']",20190507 1507030000,potenti road show team look today,6,0.0,0
3502,"['lose', 'averag', 'per', 'ride']",20190507 1504000000,lose averag per ride,4,-0.4019,0
3503,"['go', 'strike', 'pay', 'ahead', 'billion', 'harden']",20190507 1502380000,go strike pay ahead billion harden,6,-0.2263,0
3504,"['absolut', 'love', 'beat', 'rival', 'earli', 'day', 'former', 'guy', 'still', 'lost', 'lead', 'underwrit', 'role']",20190507 1502310000,absolut love beat rival earli day former guy still lost lead underwrit role,13,0.4404,0
3505,"['earn', 'creat', 'big', 'week', 'busi']",20190507 1502070000,earn creat big week busi,5,0.0,0
3506,"['week', 'tomorrow', 'threaten', 'strike', 'includ', 'compani', 'caus', 'undu', 'harm', 'climat']",20190507 1501080000,week tomorrow threaten strike includ compani caus undu harm climat,10,-0.765,-1
3507,"['strike', 'sever', 'major', 'around', 'world', 'effort', 'meant', 'coincid', 'forthcom']",20190507 1501030000,strike sever major around world effort meant coincid forthcom,9,-0.128,0
3508,"['strike', 'ahead', 'technolog', 'cloud', 'ai']",20190507 1501030000,strike ahead technolog cloud ai,5,-0.128,0
3509,"['strike', 'ahead', 'via', 'verg']",20190507 1459320000,strike ahead via verg,4,-0.128,0
3510,"['global', 'strike', 'ahead']",20190507 1458420000,global strike ahead,3,-0.128,0
3511,"['open', 'peak', 'trade', 'low', 'look', 'form', 'name', 'chang']",20190507 1458250000,open peak trade low look form name chang,8,-0.2732,0
3512,"['treat', 'us', 'like', 'crap', 'feel', 'poor', 'powerless', 'eve']",20190507 1457140000,treat us like crap feel poor powerless eve,8,-0.5719,-1
3513,"['got', 'better', 'treat', 'us', 'like', 'crap', 'feel', 'poor', 'powerless', 'eve']",20190507 1456370000,got better treat us like crap feel poor powerless eve,10,-0.2023,0
3514,"['could', 'reap', 'stun', 'return', 'zero', 'hedg']",20190507 1453480000,could reap stun return zero hedg,6,0.0,0
3515,"['highlight', 'littl', 'bit', 'tough', 'posit', 'tri', 'beat', 'gate', 'senior', 'analyst', 'upcom', 'earn', 'wait', 'see', 'jump', 'gun', 'full', 'interview']",20190507 1447550000,highlight littl bit tough posit tri beat gate senior analyst upcom earn wait see jump gun full interview,18,-0.128,0
3516,"['go', 'strike', 'pay', 'ahead', 'billion']",20190507 1447410000,go strike pay ahead billion,5,-0.2263,0
3517,"['tech', 'giant', 'valu', 'billion', 'histori', 'us', 'biggest', 'sinc', 'medium']",20190507 1445530000,tech giant valu billion histori us biggest sinc medium,9,0.0,0
3518,"['aint', 'good', 'yahoo', 'financ', 'around', 'new', 'york', 'citi', 'get', 'upcom']",20190507 1441270000,aint good yahoo financ around new york citi get upcom,10,-0.3412,0
3519,"['strike', 'ahead', 'file', 'via', 'transport']",20190507 1437250000,strike ahead file via transport,5,-0.128,0
3520,"['treat', 'us', 'like', 'crap', 'feel', 'poor', 'powerless', 'eve']",20190507 1436040000,treat us like crap feel poor powerless eve,8,-0.5719,-1
3521,"['treat', 'us', 'like', 'crap', 'feel', 'poor', 'powerless', 'eve', 'technolog', 'guardian']",20190507 1435460000,treat us like crap feel poor powerless eve technolog guardian,10,-0.5719,0
3522,"['may', 'lost', 'lead', 'morgan', 'one', 'wager', 'compani', 'may', 'return']",20190507 1435350000,may lost lead morgan one wager compani may return,9,-0.3182,0
3523,"['faro', 'data']",20190507 1433540000,faro data,2,0.0,0
3524,"['plan', 'massiv', 'global', 'strike', 'ahead']",20190507 1432070000,plan massiv global strike ahead,5,-0.128,0
3525,"['treat', 'us', 'like', 'crap', 'feel', 'poor', 'powerless', 'eve', 'technolog', 'guardian']",20190507 1430500000,treat us like crap feel poor powerless eve technolog guardian,10,-0.5719,0
3526,"['da', 'na']",20190507 1430210000,da na,2,0.0,0
3527,"['plan', 'strike', 'ralli', 'ahead', 'transport']",20190507 1430100000,plan strike ralli ahead transport,5,-0.128,0
3528,"['biggest', 'list', 'anticip', 'ahead']",20190507 1429320000,biggest list anticip ahead,4,0.0,0
3529,"['treat', 'us', 'like', 'crap', 'feel', 'poor', 'powerless', 'eve', 'technolog', 'guardian']",20190507 1428110000,treat us like crap feel poor powerless eve technolog guardian,10,-0.5719,0
3530,"['global', 'strike', 'ahead']",20190507 1427550000,global strike ahead,3,-0.128,0
3531,"['tactic', 'pursuit', 'growth', 'technolog', 'news']",20190507 1426210000,tactic pursuit growth technolog news,5,0.3818,0
3532,"['strike', 'date']",20190507 1425050000,strike date,2,-0.128,-1
3533,"['compani', 'turn', 'profit', 'still', 'make', 'could', 'reap', 'stun', 'return', 'zero', 'hedg']",20190507 1422420000,compani turn profit still make could reap stun return zero hedg,11,0.4404,1
3534,"['go', 'public', 'good', 'know', 'see', 'report']",20190507 1420560000,go public good know see report,6,0.4404,0
3535,"['treat', 'us', 'like', 'crap', 'feel', 'poor', 'powerless', 'eve', 'technolog']",20190507 1415360000,treat us like crap feel poor powerless eve technolog,9,-0.5719,0
3536,"['strike', 'ahead', 'log', 'may', 'via']",20190507 1415260000,strike ahead log may via,5,-0.128,0
