,content,date,text,Length,sid_sentiment,finbert_label
4989,"['global', 'strike', 'via']",20190508 1807580000,global strike via,3,-0.128,0
4990,"['price', 'toward', 'low', 'end']",20190508 1807480000,price toward low end,4,-0.2732,0
4991,"['threaten', 'billion']",20190508 1807100000,threaten billion,2,-0.3818,0
4992,"['set', 'price', 'rang', 'share', 'valuat', 'billion', 'billion']",20190508 1806000000,set price rang share valuat billion billion,7,0.296,0
4993,"['peopl', 'go', 'crazi', 'alreadi']",20190508 1805430000,peopl go crazi alreadi,4,0.0,0
4994,"['strike', 'ahead']",20190508 1805350000,strike ahead,2,-0.128,-1
4995,"['nope', 'today', 'group', 'strike', 'treat']",20190508 1805130000,nope today group strike treat,5,0.4714,-1
4996,"['much', 'stock', 'theyr', 'sell', 'alway', 'there', 'much', 'demand', 'stock', 'good', 'news', 'mayb', 'wont', 'much', 'sell', 'pressur']",20190508 1805100000,much stock theyr sell alway there much demand stock good news mayb wont much sell pressur,16,0.34,0
4997,"['market', 'could', 'take', 'punch', 'potenti', 'tariff', 'concern']",20190508 1804520000,market could take punch potenti tariff concern,7,0.0,-1
4998,"['discuss', 'strike', 'ahead']",20190508 1804420000,discuss strike ahead,3,-0.128,-1
4999,"['price', 'target', 'rang', 'sourc']",20190508 1803570000,price target rang sourc,4,0.0,0
5000,"['set', 'price', 'target', 'rang']",20190508 1803040000,set price target rang,4,0.0,0
5001,"['anoth', 'tech', 'disappoint', 'store', 'could', 'forecast', 'last', 'year', 'reiter', 'earli', 'go', 'see', 'end', 'wildli', 'excess', 'valuat', 'boom', 'tech']",20190508 1802500000,anoth tech disappoint store could forecast last year reiter earli go see end wildli excess valuat boom tech,18,-0.4019,0
5002,"['price', 'target']",20190508 1802380000,price target,2,0.0,0
5003,"['celebr', 'go', 'show', 'strength', 'taxi', 'fleet', 'mobil']",20190508 1802270000,celebr go show strength taxi fleet mobil,7,0.4939,0
5004,"['price', 'target', 'rang', 'per', 'share', 'file', 'last', 'month']",20190508 1802220000,price target rang per share file last month,8,0.296,0
5005,"['price', 'target', 'rang', 'sourc']",20190508 1802150000,price target rang sourc,4,0.0,0
5006,"['set', 'get', 'final', 'soon']",20190508 1801550000,set get final soon,4,0.0,0
5007,"['bien', 'vise', 'ba', 'de', 'canal', 'pour', 'de', 'son', 'action', 'cest', 'bours']",20190508 1801300000,bien vise ba de canal pour de son action cest bours,11,0.0,0
5008,"['invest', 'stock', 'sober', 'sign', 'global', 'strike', 'via']",20190508 1801160000,invest stock sober sign global strike via,7,-0.128,0
5009,"['price', 'target', 'rang', 'via']",20190508 1800500000,price target rang via,4,0.0,0
5010,"['could', 'strike', 'impact', 'equiti', 'research', 'analyst', 'provid', 'earn', 'appear', 'technolog']",20190508 1800390000,could strike impact equiti research analyst provid earn appear technolog,10,-0.128,0
5011,"['plan', 'global', 'strike', 'honor', 'via']",20190508 1800290000,plan global strike honor via,5,0.4019,0
5012,"['plan', 'global', 'strike', 'honor', 'via']",20190508 1800290000,plan global strike honor via,5,0.4019,0
5013,"['plan', 'global', 'strike', 'honor', 'via']",20190508 1800290000,plan global strike honor via,5,0.4019,0
5014,"['plan', 'global', 'strike', 'honor', 'via']",20190508 1800290000,plan global strike honor via,5,0.4019,0
5015,"['plan', 'global', 'strike', 'honor', 'via']",20190508 1800290000,plan global strike honor via,5,0.4019,0
5016,"['stage', 'intern', 'eve', 'technolog']",20190508 1800210000,stage intern eve technolog,4,0.0,0
5017,"['across', 'countri', 'today', 'well', 'smaller', 'competitor', 'strike', 'bring', 'awar', 'work', 'eve', 'histor', 'us']",20190508 1800120000,across countri today well smaller competitor strike bring awar work eve histor us,13,0.1531,-1
5018,"['big', 'hotli']",20190508 1800000000,big hotli,2,0.0,0
5019,"['make', 'million', 'repeatedli', 'slash', 'pay', 'basic', 'today', 'stand', 'stand']",20190508 1800000000,make million repeatedli slash pay basic today stand stand,9,-0.3612,0
5020,"['gear', 'big', 'debut']",20190508 1759400000,gear big debut,3,0.0,0
5021,"['tell', 'set', 'price', 'rang']",20190508 1759290000,tell set price rang,4,0.0,0
5022,"['exclus', 'headlin', 'say', 'price', 'low', 'end', 'target', 'rang']",20190508 1759160000,exclus headlin say price low end target rang,8,-0.2732,0
5023,"['set', 'price', 'rang', 'per', 'share', 'fulli', 'dilut', 'basi', 'would', 'put', 'valuat', 'billion', 'low', 'end', 'rang', 'billion', 'high', 'end', 'price', 'target', 'rang']",20190508 1758460000,set price rang per share fulli dilut basi would put valuat billion low end rang billion high end price target rang,21,0.0258,0
5024,"['well', 'unfortun', 'mention', 'thirsti']",20190508 1758320000,well unfortun mention thirsti,4,0.2732,0
5025,"['price', 'target', 'car', 'auto', 'market']",20190508 1758270000,price target car auto market,5,0.0,0
5026,"['price', 'target', 'rang', 'sourc']",20190508 1758000000,price target rang sourc,4,0.0,0
5027,"['price', 'target', 'rang', 'per', 'share', 'file', 'last', 'month']",20190508 1757580000,price target rang per share file last month,8,0.296,0
5028,"['reportedli', 'set', 'price', 'target']",20190508 1757550000,reportedli set price target,4,0.0,0
5029,"['strike', 'ahead']",20190508 1757520000,strike ahead,2,-0.128,-1
5030,"['price', 'target', 'rang', 'sourc']",20190508 1757160000,price target rang sourc,4,0.0,0
5031,"['price', 'target', 'rang', 'sourc', 'familiar', 'matter', 'told']",20190508 1756580000,price target rang sourc familiar matter told,7,0.0258,0
5032,"['think', 'upcom']",20190508 1756520000,think upcom,2,0.0,0
5033,"['price', 'target', 'rang', 'sourc']",20190508 1756500000,price target rang sourc,4,0.0,0
5034,"['price', 'target', 'rang', 'sourc']",20190508 1756390000,price target rang sourc,4,0.0,0
5035,"['count', 'strike', 'strike', 'across', 'world']",20190508 1756350000,count strike strike across world,5,-0.25,-1
5036,"['set', 'price', 'target', 'rang']",20190508 1756300000,set price target rang,4,0.0,0
5037,"['price', 'target', 'rang']",20190508 1755500000,price target rang,3,0.0,0
5038,"['interest', 'reason', 'behind', 'thesi', 'risk', 'phantom', 'inflat', 'unicorn', 'come', 'upon', 'contact', 'public', 'trigger', 'actual', 'caus', 'sell']",20190508 1755430000,interest reason behind thesi risk phantom inflat unicorn come upon contact public trigger actual caus sell,16,0.2263,0
5039,"['price', 'target', 'rang', 'sourc']",20190508 1755350000,price target rang sourc,4,0.0,0
5040,"['big', 'scoop', 'set', 'price', 'rang', 'lower', 'blockbust', 'continu', 'deflat', 'dont', 'worri', 'still', 'pois', 'second', 'ever']",20190508 1755060000,big scoop set price rang lower blockbust continu deflat dont worri still pois second ever,15,-0.1531,0
5041,"['goe', 'live', 'perhap', 'pay', 'peopl', 'live', 'follow', 'live', 'ground']",20190508 1755010000,goe live perhap pay peopl live follow live ground,9,-0.1027,0
5042,"['thank', 'strike', 'foot', 'drive', 'like', 'make', 'well']",20190508 1754530000,thank strike foot drive like make well,7,0.6808,0
5043,"['set', 'price', 'target', 'rang', 'via']",20190508 1754520000,set price target rang via,5,0.0,0
5044,"['stop', 'coo', 'go', 'talk', 'strike', 'recent', 'gig', 'economi', 'whole', 'tune']",20190508 1754380000,stop coo go talk strike recent gig economi whole tune,10,-0.4019,0
5045,"['celebr', 'go', 'strike']",20190508 1754020000,celebr go strike,3,-0.128,0
5046,"['side', 'us', 'well', 'us', 'fairli', 'wed', 'cheer', 'wish', 'success', 'instead', 'treatment', 'everi', 'driver', 'fail', 'fire']",20190508 1753450000,side us well us fairli wed cheer wish success instead treatment everi driver fail fire,15,0.7096,0
5048,"['price', 'target', 'rang', 'sourc']",20190508 1753250000,price target rang sourc,4,0.0,0
5049,"['set', 'price', 'target', 'rang']",20190508 1753120000,set price target rang,4,0.0,0
5051,"['set', 'price', 'target', 'rang', 'via', 'like', 'may', 'see', 'tomorrow']",20190508 1752410000,set price target rang via like may see tomorrow,9,0.3612,0
5052,"['predict', 'strong', 'pop', 'first', 'day', 'first', 'quarter']",20190508 1752000000,predict strong pop first day first quarter,7,0.5106,1
5053,"['price', 'target']",20190508 1751490000,price target,2,0.0,0
5054,"['price', 'target', 'rang', 'sourc']",20190508 1751400000,price target rang sourc,4,0.0,0
5055,"['corpor', 'set', 'make', 'left', 'poverti', 'go', 'bankrupt']",20190508 1751270000,corpor set make left poverti go bankrupt,7,-0.5574,0
5056,"['exclus', 'set', 'price', 'target', 'rang']",20190508 1751040000,exclus set price target rang,5,0.0,0
5057,"['set', 'price', 'target', 'rang']",20190508 1750430000,set price target rang,4,0.0,0
5058,"['support', 'strike', 'today', 'worth', 'week', 'classifi', 'independ', 'health', 'insur', 'leav']",20190508 1750420000,support strike today worth week classifi independ health insur leav,10,0.4767,0
5059,"['set', 'price', 'target', 'rang']",20190508 1750190000,set price target rang,4,0.0,0
5060,"['w', 'r', 'na']",20190508 1750000000,w r na,3,0.0,0
5061,"['price', 'target', 'rang', 'sourc']",20190508 1749340000,price target rang sourc,4,0.0,0
5062,"['price', 'target', 'rang', 'sourc']",20190508 1749290000,price target rang sourc,4,0.0,0
5063,"['rich', 'peopl', 'get', 'even', 'compani', 'goe', 'public']",20190508 1749190000,rich peopl get even compani goe public,7,0.5574,1
5064,"['wall', 'street', 'journal', 'news', 'alert', 'set', 'price', 'target', 'rang']",20190508 1749000000,wall street journal news alert set price target rang,9,0.296,0
5065,"['price', 'target', 'rang', 'technolog', 'busi']",20190508 1748520000,price target rang technolog busi,5,0.0,0
5066,"['price', 'target', 'rang', 'sourc']",20190508 1748460000,price target rang sourc,4,0.0,0
5067,"['entic', 'ahead', 'driver', 'dissatisfact', 'increas']",20190508 1747540000,entic ahead driver dissatisfact increas,5,0.0,0
5068,"['date', 'chosen', 'coincid', 'hit', 'hard', 'new', 'time', 'low', 'stock', 'price']",20190508 1747490000,date chosen coincid hit hard new time low stock price,10,-0.3612,-1
5069,"['worker', 'could', 'come', 'wors', 'time', 'pay', 'compani', 'tri', 'figur', 'spin', 'dont', 'pay', 'best', 'week']",20190508 1747490000,worker could come wors time pay compani tri figur spin dont pay best week,14,-0.538,0
5070,"['set', 'price', 'target', 'rang', 'via']",20190508 1747370000,set price target rang via,5,0.0,0
5071,"['new', 'report', 'odd', 'make', 'money', 'technolog', 'initi', 'public', 'offer', 'first', 'year', 'good', 'stay', 'away']",20190508 1747150000,new report odd make money technolog initi public offer first year good stay away,14,0.1531,0
5072,"['strike', 'around', 'world', 'ahead', 'taxi', 'allianc', 'execut', 'director', 'group', 'driver', 'strike', 'hold', 'press', 'confer', 'strike', 'morn']",20190508 1747030000,strike around world ahead taxi allianc execut director group driver strike hold press confer strike morn,16,-0.3612,0
5073,"['dose', 'pull', 'valu']",20190508 1746350000,dose pull valu,3,0.0,0
5074,"['set', 'price', 'target', 'rang']",20190508 1746250000,set price target rang,4,0.0,0
5075,"['price', 'target', 'rang', 'sourc']",20190508 1746240000,price target rang sourc,4,0.0,0
5076,"['price', 'target', 'rang', 'sourc']",20190508 1746170000,price target rang sourc,4,0.0,0
5077,"['break', 'price', 'target', 'rang', 'sourc']",20190508 1746000000,break price target rang sourc,5,0.0,0
5078,"['set', 'price', 'target', 'rang']",20190508 1745500000,set price target rang,4,0.0,0
5079,"['break', 'price', 'target', 'rang', 'sourc']",20190508 1745470000,break price target rang sourc,5,0.0,0
5080,"['stock', 'price', 'valuat', 'fulli', 'dilut', 'basi', 'roughli', 'year', 'lead', 'compani', 'valuat', 'much']",20190508 1744400000,stock price valuat fulli dilut basi roughli year lead compani valuat much,12,0.0,0
5081,"['would', 'pass', 'trade', 'unless', 'get', 'piec', 'actual']",20190508 1744100000,would pass trade unless get piec actual,7,0.0,0
5082,"['strike', 'protest', 'ahead', 'via']",20190508 1743190000,strike protest ahead via,4,-0.3612,-1
5083,"['strike', 'ahead']",20190508 1743140000,strike ahead,2,-0.128,-1
5084,"['weird', 'right', 'nobodi', 'forc', 'work', 'full', 'time', 'work', 'work']",20190508 1743120000,weird right nobodi forc work full time work work,9,-0.1779,0
5085,"['set', 'price', 'target', 'rang']",20190508 1743010000,set price target rang,4,0.0,0
5086,"['set', 'price', 'target', 'rang']",20190508 1742590000,set price target rang,4,0.0,0
5087,"['set', 'price', 'target', 'rang']",20190508 1742210000,set price target rang,4,0.0,0
5088,"['set', 'price', 'target', 'rang']",20190508 1742090000,set price target rang,4,0.0,0
5089,"['set', 'price', 'target', 'rang']",20190508 1742060000,set price target rang,4,0.0,0
5090,"['thing', 'path', 'profit', 'via', 'noth', 'els', 'save', 'that', 'go', 'eventu', 'happen', 'probabl', 'go', 'happen', 'soon', 'enough', 'take', 'stake', 'bet', 'rapid']",20190508 1742030000,thing path profit via noth els save that go eventu happen probabl go happen soon enough take stake bet rapid,20,0.7269,0
5091,"['track', 'price', 'target', 'follow', 'big', 'drop', 'rival', 'disappoint', 'debut']",20190508 1741570000,track price target follow big drop rival disappoint debut,9,-0.5859,-1
5092,"['set', 'price', 'target', 'rang']",20190508 1741570000,set price target rang,4,0.0,0
5093,"['set', 'price', 'target', 'rang']",20190508 1741550000,set price target rang,4,0.0,0
5094,"['track', 'price', 'target', 'follow', 'big', 'drop', 'rival', 'disappoint', 'debut', 'wall', 'street', 'journal']",20190508 1741490000,track price target follow big drop rival disappoint debut wall street journal,12,-0.5859,-1
5095,"['moral', 'vale', 'de', 'boa']",20190508 1741200000,moral vale de boa,4,0.0,0
5096,"['break', 'reportedli', 'set', 'place', 'price', 'target', 'rang']",20190508 1741000000,break reportedli set place price target rang,7,0.0,0
5097,"['moral', 'vale', 'de', 'boa']",20190508 1740100000,moral vale de boa,4,0.0,0
5098,"['reveal', 'lot', 'probabl', 'futur', 'compani', 'doesnt', 'clear', 'road', 'profit', 'give', 'paus', 'think', 'public', 'transit']",20190508 1739360000,reveal lot probabl futur compani doesnt clear road profit give paus think public transit,14,-0.5559,0
5099,['price'],20190508 1739280000,price,1,0.0,0
5100,"['pois', 'price', 'rang', 'lower']",20190508 1739250000,pois price rang lower,4,-0.296,0
5101,"['ahead', 'later', 'week', 'went', 'strike']",20190508 1739240000,ahead later week went strike,5,-0.128,0
5102,"['price', 'rang']",20190508 1739140000,price rang,2,0.0,0
5103,"['set', 'price', 'late', 'ahead', 'trade', 'debut']",20190508 1738340000,set price late ahead trade debut,6,0.0,0
5104,"['driver', 'morn', 'said', 'per', 'fare', 'went', 'sinc', 'last', 'week', 'made', 'think', 'evil', 'thread', 'theyr', 'increas', 'share', 'intent', 'tank', 'avoid', 'fate', 'time', 'pretti', 'conveni']",20190508 1738230000,driver morn said per fare went sinc last week made think evil thread theyr increas share intent tank avoid fate time pretti conveni,23,-0.6597,0
5105,"['set', 'price', 'target', 'rang', 'disappoint', 'debut', 'market', 'swoon', 'weigh', 'demand', 'stock']",20190508 1738220000,set price target rang disappoint debut market swoon weigh demand stock,11,-0.4939,-1
5106,"['set', 'price', 'target', 'rang']",20190508 1738200000,set price target rang,4,0.0,0
5107,"['profit', 'even', 'road']",20190508 1737430000,profit even road,3,0.4404,0
5108,"['great', 'situat', 'everyon', 'empathi', 'especi', 'long', 'term', 'loyalist', 'understand', 'cash', 'bonu', 'program', 'long', 'sure', 'effect', 'way', 'get']",20190508 1736520000,great situat everyon empathi especi long term loyalist understand cash bonu program long sure effect way get,17,0.836,0
5109,"['floor', 'chatter', 'doesnt', 'make', 'money', 'via']",20190508 1736500000,floor chatter doesnt make money via,6,0.0,0
5110,"['ahead', 'later', 'week', 'went', 'strike']",20190508 1736250000,ahead later week went strike,5,-0.128,0
5111,"['interest', 'evalu']",20190508 1736070000,interest evalu,2,0.4588,0
5112,"['strike', 'time', 'action', 'draw', 'attent', 'wage', 'persist', 'job', 'insecur', 'ahead', 'valuat', 'may', 'high']",20190508 1736000000,strike time action draw attent wage persist job insecur ahead valuat may high,13,-0.128,-1
5113,"['rich', 'peopl', 'get', 'even', 'compani', 'goe', 'public']",20190508 1735440000,rich peopl get even compani goe public,7,0.5574,1
5114,"['problem', 'strike', 'definit', 'set', 'number', 'strike', 'resolut', 'sad', 'part', 'well', 'could', 'backfir', 'benefit']",20190508 1735120000,problem strike definit set number strike resolut sad part well could backfir benefit,13,-0.34,-1
5115,"['signal', 'grave', 'wrong', 'economi', 'environ', 'lose', 'rich', 'get']",20190508 1734280000,signal grave wrong economi environ lose rich get,8,-0.5859,-1
5116,"['treat', 'us', 'like', 'crap', 'feel', 'poor', 'powerless', 'eve']",20190508 1734050000,treat us like crap feel poor powerless eve,8,-0.5719,-1
5117,"['make', 'peopl', 'potenti', 'drive', 'pay', 'symptomat', 'grow', 'inequ', 'economi']",20190508 1733470000,make peopl potenti drive pay symptomat grow inequ economi,9,-0.1027,0
5118,"['plan', 'strike', 'ahead']",20190508 1733440000,plan strike ahead,3,-0.128,0
5119,"['prospectu', 'us', 'arbitr', 'legal', 'say', 'take', 'resolv', 'cost']",20190508 1732020000,prospectu us arbitr legal say take resolv cost,8,0.128,0
5120,"['celebr', 'go', 'strike']",20190508 1732000000,celebr go strike,3,-0.128,0
5121,"['ye', 'theyr', 'profit', 'consid']",20190508 1731510000,ye theyr profit consid,4,0.4404,0
5122,"['us', 'plan', 'strike', 'low', 'wage', 'ahead']",20190508 1730130000,us plan strike low wage ahead,6,-0.3818,-1
5123,"['set', 'go', 'strike', 'today', 'ahead']",20190508 1730110000,set go strike today ahead,5,-0.128,-1
5124,"['go', 'strike', 'pay', 'ahead', 'billion']",20190508 1729210000,go strike pay ahead billion,5,-0.2263,0
5125,"['enabl', 'use']",20190508 1729080000,enabl use,2,0.0,0
5126,"['trade', 'bad', 'news', 'usual', 'come', 'tether', 'first', 'second', 'exchang', 'round', 'month', 'week']",20190508 1728410000,trade bad news usual come tether first second exchang round month week,12,-0.5423,-1
5127,"['enabl', 'use']",20190508 1728320000,enabl use,2,0.0,0
5128,['pleas'],20190508 1728100000,pleas,1,0.0,0
5129,"['imposs', 'tell', 'would', 'figur', 'wall', 'st', 'didnt', 'want', 'movement', 'huge']",20190508 1726520000,imposs tell would figur wall st didnt want movement huge,10,-0.2924,0
5130,"['new', 'york', 'taxi']",20190508 1725080000,new york taxi,3,0.0,0
5131,"['global', 'protest', 'ahead']",20190508 1725030000,global protest ahead,3,-0.25,-1
5132,"['strike', 'around', 'world', 'today', 'protest', 'wage', 'arriv', 'ahead', 'end', 'week']",20190508 1723410000,strike around world today protest wage arriv ahead end week,10,-0.3612,-1
5133,"['strike', 'around', 'world', 'today', 'protest', 'wage', 'arriv', 'ahead', 'end', 'week']",20190508 1723060000,strike around world today protest wage arriv ahead end week,10,-0.3612,-1
5134,"['exchang', 'na', 'os', 'ae', 'para', 'os']",20190508 1723040000,exchang na os ae para os,6,0.0,0
5135,"['celebr', 'go', 'strike']",20190508 1721460000,celebr go strike,3,-0.128,0
5136,"['ahead', 'later', 'week', 'went', 'strike']",20190508 1720390000,ahead later week went strike,5,-0.128,0
5137,"['driver', 'ahead', 'spell', 'uncertain', 'futur', 'gig', 'economi']",20190508 1720200000,driver ahead spell uncertain futur gig economi,7,-0.296,0
5138,"['rich', 'go', 'strike', 'us']",20190508 1719380000,rich go strike us,4,0.4767,0
5139,"['what', 'take', 'part', 'organ', 'strike']",20190508 1719280000,what take part organ strike,5,-0.128,0
5140,"['roll', 'across', 'world', 'goe']",20190508 1717510000,roll across world goe,4,0.0,0
5141,"['consid', 'day', 'take', 'look', 'key', 'rule', 'snap', 'mani', 'new', 'stock', 'first']",20190508 1716380000,consid day take look key rule snap mani new stock first,11,0.0,0
5142,"['strike', 'today', 'ahead', 'li']",20190508 1716370000,strike today ahead li,4,-0.128,-1
5143,"['come', 'readi', 'buy', 'stock', 'aim', 'rais', 'disrupt', 'compani', 'still', 'model', 'busi', 'model', 'social', 'impact']",20190508 1716270000,come readi buy stock aim rais disrupt compani still model busi model social impact,14,0.0,0
5144,"['strike', 'today', 'ahead']",20190508 1715340000,strike today ahead,3,-0.128,-1
5145,"['rich', 'go', 'strike', 'us', 'articl']",20190508 1715180000,rich go strike us articl,5,0.4767,0
5146,"['one', 'group', 'wont', 'benefit', 'much', 'strike', 'ahead']",20190508 1714260000,one group wont benefit much strike ahead,7,-0.2755,0
5147,"['go', 'strike', 'protest', 'low', 'pay', 'ahead', 'blockbust']",20190508 1714210000,go strike protest low pay ahead blockbust,7,-0.6124,-1
5148,"['strike', 'today', 'ahead']",20190508 1714040000,strike today ahead,3,-0.128,-1
5149,"['stock', 'forev']",20190508 1713390000,stock forev,2,0.0,0
5150,['futur'],20190508 1712300000,futur,1,0.0,0
5151,"['day', 'start', 'big']",20190508 1711220000,day start big,3,0.0,0
5152,"['news', 'strike', 'ahead']",20190508 1709300000,news strike ahead,3,-0.128,-1
5153,"['loom', 'demand', 'higher', 'via']",20190508 1709080000,loom demand higher via,4,-0.34,1
5154,"['import', 'driver', 'abus', 'eros', 'worker', 'protect', 'deliber', 'undermin', 'public', 'transit', 'time', 'protect', 'tax', 'hell', 'fund', 'public', 'transport', 'infrastructur']",20190508 1707410000,import driver abus eros worker protect deliber undermin public transit time protect tax hell fund public transport infrastructur,18,-0.1027,0
5155,"['global', 'strike']",20190508 1707040000,global strike,2,-0.128,0
5156,"['strike', 'low', 'wage', 'ahead', 'via']",20190508 1705520000,strike low wage ahead via,5,-0.3818,-1
5157,"['sorri', 'luck', 'nervou', 'particular']",20190508 1702370000,sorri luck nervou particular,4,0.4588,0
5158,"['global', 'strike']",20190508 1702330000,global strike,2,-0.128,0
5159,"['day', 'go', 'strike']",20190508 1702160000,day go strike,3,-0.128,0
5160,"['mani', 'talk']",20190508 1702130000,mani talk,2,0.0,0
5161,"['rich', 'go', 'strike', 'us']",20190508 1702120000,rich go strike us,4,0.4767,0
5162,"['strike', 'ahead']",20190508 1702090000,strike ahead,2,-0.128,-1
5163,"['strike', 'protest', 'ahead']",20190508 1702070000,strike protest ahead,3,-0.3612,-1
5164,"['collater', 'initi', 'public', 'offer', 'news', 'social', 'news']",20190508 1702040000,collater initi public offer news social news,7,0.0,0
5165,"['drive', 'drive', 'today', 'drop', 'comment', 'strike']",20190508 1701590000,drive drive today drop comment strike,6,-0.3818,-1
5166,"['strike', 'ahead']",20190508 1701030000,strike ahead,2,-0.128,-1
5167,"['ahead', 'giant', 'competitor', 'turn', 'protest', 'wage', 'time', 'rake']",20190508 1700570000,ahead giant competitor turn protest wage time rake,8,-0.25,0
5168,"['strike', 'ahead']",20190508 1700370000,strike ahead,2,-0.128,-1
5169,"['earn', 'hour', 'get', 'screw', 'kept', 'independ', 'valuat', 'absurd', 'billion', 'pay', 'support', 'strike', 'end']",20190508 1700310000,earn hour get screw kept independ valuat absurd billion pay support strike end,13,0.1027,-1
5170,"['follow', 'saga', 'appear', 'equiti', 'research', 'analyst', 'discuss', 'earn', 'report', 'first', 'trade']",20190508 1700180000,follow saga appear equiti research analyst discuss earn report first trade,11,0.0,0
5171,"['day', 'go', 'strike']",20190508 1700130000,day go strike,3,-0.128,0
5172,"['strike', 'us']",20190508 1700010000,strike us,2,-0.128,-1
5173,"['coo', 'guest', 'morn', 'hell', 'discuss', 'loom', 'strike', 'tune', 'today']",20190508 1700000000,coo guest morn hell discuss loom strike tune today,9,-0.7906,0
5174,"['whole', 'world', 'instead', 'watch', 'union', 'limousin', 'associ', 'wrote']",20190508 1659510000,whole world instead watch union limousin associ wrote,8,0.0,0
5175,['get'],20190508 1659290000,get,1,0.0,0
5176,"['tactic', 'pursuit', 'growth']",20190508 1657110000,tactic pursuit growth,3,0.3818,0
5177,"['strike', 'ahead', 'protest', 'low', 'wage', 'lack']",20190508 1656330000,strike ahead protest low wage lack,6,-0.7096,-1
5178,"['strike', 'us', 'via']",20190508 1656110000,strike us via,3,-0.128,0
5181,"['day', 'start', 'sooner', 'larg', 'driver']",20190508 1653430000,day start sooner larg driver,5,0.0,-1
5182,"['china', 'de', 'si', 'en', 'la', 'wall', 'street', 'en', 'q', 'se', 'el', 'mayor']",20190508 1653330000,china de si en la wall street en q se el mayor,12,0.0,0
5183,"['collater', 'initi', 'public', 'offer', 'news']",20190508 1653220000,collater initi public offer news,5,0.0,0
5184,"['treat', 'us', 'like', 'crap', 'feel', 'poor', 'powerless', 'eve']",20190508 1653050000,treat us like crap feel poor powerless eve,8,-0.5719,-1
5185,"['amidst', 'news', 'forgotten', 'know', 'astonish', 'percent', 'dont', 'see', 'often', 'that', 'ai']",20190508 1652520000,amidst news forgotten know astonish percent dont see often that ai,11,-0.2263,0
5186,"['today', 'come', 'pipelin', 'look', 'make', 'money', 'spend', 'undercut', 'taxi', 'upset', 'hold', 'beer']",20190508 1652150000,today come pipelin look make money spend undercut taxi upset hold beer,12,-0.3818,0
5187,"['sleep', 'park', 'lot', 'make', 'live']",20190508 1651150000,sleep park lot make live,5,0.0,0
5188,"['hey', 'check', 'collater', 'initi', 'public', 'offer', 'via', 'quarri']",20190508 1650290000,hey check collater initi public offer via quarri,8,0.0,0
5189,"['collater', 'initi', 'public', 'offer']",20190508 1650250000,collater initi public offer,4,0.0,0
5190,"['hey', 'check', 'collater', 'initi', 'public', 'offer', 'via', 'quarri']",20190508 1650240000,hey check collater initi public offer via quarri,8,0.0,0
5191,"['ever', 'need', 'head', 'arbitr', 'addict', 'could', 'death']",20190508 1650220000,ever need head arbitr addict could death,7,-0.5994,0
