,content,date,text,Length,sid_sentiment,finbert_label
1615,"['investor', 'group', 'board', 'ahead']",20190504 0111140000,investor group board ahead,4,0.0,0
1616,"['price', 'right', 'growth', 'sketchi', 'new', 'street']",20190504 0111130000,price right growth sketchi new street,6,0.3818,0
1617,"['one', 'stop', 'shop', 'transport', 'ahead']",20190504 0111120000,one stop shop transport ahead,5,-0.296,0
1618,"['plan', 'strike', 'ralli', 'ahead']",20190504 0110230000,plan strike ralli ahead,4,-0.128,0
1619,"['current', 'board', 'wont', 'let', 'founder', 'join', 'ring', 'open', 'bell', 'wall', 'street', 'never', 'thought', 'would', 'say', 'capit']",20190504 0105360000,current board wont let founder join ring open bell wall street never thought would say capit,16,-0.2235,0
1620,"['week', 'ahead', 'market']",20190504 0105080000,week ahead market,3,0.0,0
1621,"['probabl', 'wont', 'impact', 'fulli', 'good', 'look', 'though', 'could', 'blow', 'fund', 'dog', 'onto', 'fund', 'hold', 'mum', 'dad', 'street', 'screw', 'main', 'street']",20190504 0104490000,probabl wont impact fulli good look though could blow fund dog onto fund hold mum dad street screw main street,20,-0.4226,0
1622,"['new', 'york', 'strike', 'ahead', 'lean']",20190504 0104420000,new york strike ahead lean,5,-0.128,-1
1623,"['report', 'bar', 'ex', 'balconi']",20190504 0104060000,report bar ex balconi,4,0.0,0
1624,"['updat', 'report', 'bar', 'ex', 'balconi']",20190504 0104010000,updat report bar ex balconi,5,0.0,0
1625,"['new', 'york', 'strike', 'ahead']",20190504 0103330000,new york strike ahead,4,-0.128,-1
1626,"['hand', 'weigh', 'idea', 'billion', 'vision', 'fund']",20190504 0102510000,hand weigh idea billion vision fund,6,0.6369,0
1627,"['report', 'bar', 'ex', 'balconi']",20190504 0100560000,report bar ex balconi,4,0.0,0
1628,"['new', 'york', 'strike', 'ahead', 'trump']",20190504 0057400000,new york strike ahead trump,5,-0.128,0
1629,"['new', 'york', 'strike', 'ahead', 'eu', 'financ']",20190504 0057400000,new york strike ahead eu financ,6,-0.128,-1
1630,"['leav', 'one', 'big', 'unansw', 'question']",20190504 0056130000,leav one big unansw question,5,0.0,0
1631,"['stage', 'massiv', 'strike']",20190504 0055480000,stage massiv strike,3,-0.128,0
1632,"['updat', 'new', 'york', 'strike', 'ahead', 'eu', 'financ']",20190504 0055410000,updat new york strike ahead eu financ,7,-0.128,0
1633,"['updat', 'new', 'york', 'strike', 'ahead', 'trump']",20190504 0055400000,updat new york strike ahead trump,6,-0.128,0
1634,"['damn', 'world', 'fair', 'screw', 'driver', 'bonu', 'didnt', 'trip', 'screw', 'u', 'wors', 'ring', 'bell', 'compani', 'u', 'take']",20190504 0054280000,damn world fair screw driver bonu didnt trip screw u wors ring bell compani u take,16,-0.129,0
1635,"['week', 'ahead', 'market']",20190504 0054230000,week ahead market,3,0.0,0
1636,"['independ', 'contractor', 'test', 'retroact', 'us']",20190504 0052220000,independ contractor test retroact us,5,0.0,0
1637,"['report', 'bar', 'ex', 'balconi']",20190504 0052100000,report bar ex balconi,4,0.0,0
1638,"['new', 'york', 'strike', 'ahead', 'technolog']",20190504 0052020000,new york strike ahead technolog,5,-0.128,0
1639,"['ring', 'next', 'week', 'founder']",20190504 0050390000,ring next week founder,4,0.0,0
1640,"['hand', 'weigh', 'idea', 'billion', 'vision', 'fund']",20190504 0049440000,hand weigh idea billion vision fund,6,0.6369,0
1641,"['report', 'bar', 'ex', 'balconi']",20190504 0049020000,report bar ex balconi,4,0.0,0
1642,"['updat', 'new', 'york', 'strike', 'ahead', 'news']",20190504 0045110000,updat new york strike ahead news,6,-0.128,0
1643,"['disconnect', 'form', 'idea', 'lose', 'money', 'hold', 'place', 'market', 'came', 'well', 'aint', 'happen', 'gon', 'na', 'go', 'quick', 'milk', 'em', 'dri', 'catch', 'henc']",20190504 0044470000,disconnect form idea lose money hold place market came well aint happen gon na go quick milk em dri catch henc,21,-0.1531,0
1644,"['new', 'york', 'strike', 'ahead']",20190504 0043320000,new york strike ahead,4,-0.128,-1
1645,"['new', 'york', 'strike', 'ahead']",20190504 0040480000,new york strike ahead,4,-0.128,-1
1646,"['wealth', 'fund', 'made', 'record', 'look']",20190504 0040050000,wealth fund made record look,5,0.4939,0
1647,"['new', 'york', 'strike', 'ahead', 'news']",20190504 0039550000,new york strike ahead news,5,-0.128,-1
1648,"['travi', 'day']",20190504 0037340000,travi day,2,0.0,0
1649,"['report', 'bar', 'ex', 'balconi', 'travel']",20190504 0036540000,report bar ex balconi travel,5,0.0,0
1651,"['pay', 'close', 'attent', 'new', 'york', 'citi', 'quartz']",20190504 0031380000,pay close attent new york citi quartz,7,-0.1027,0
1652,"['next', 'week', 'trade', 'might']",20190504 0031090000,next week trade might,4,0.0,0
1653,"['one', 'drive', 'unless', 'know', 'truth', 'cover', 'car']",20190504 0029560000,one drive unless know truth cover car,7,0.3182,0
1654,"['short', 'easiest', 'money', 'u', 'ever', 'make', 'life', 'ur', 'welcom']",20190504 0028470000,short easiest money u ever make life ur welcom,9,0.4215,0
1655,"['report', 'bar', 'ex', 'balconi', 'associ', 'press', 'via']",20190504 0026070000,report bar ex balconi associ press via,7,0.0,0
1656,"['let', 'pick', 'carcass']",20190504 0025140000,let pick carcass,3,0.0,0
1657,"['seen', 'scoop', 'wave', 'via']",20190504 0025020000,seen scoop wave via,4,0.1531,0
1658,"['report', 'bar', 'ex', 'balconi', 'associ', 'press', 'via']",20190504 0023290000,report bar ex balconi associ press via,7,0.0,0
1659,"['updat', 'wealth', 'fund', 'made', 'record', 'look']",20190504 0022080000,updat wealth fund made record look,6,0.4939,1
1660,"['new', 'york', 'strike', 'ahead']",20190504 0022060000,new york strike ahead,4,-0.128,-1
1661,"['report', 'bar', 'ex', 'balconi']",20190504 0020050000,report bar ex balconi,4,0.0,0
1662,"['let', 'pick', 'carcass']",20190504 0019500000,let pick carcass,3,0.0,0
1663,"['pay', 'close', 'attent', 'new', 'york', 'citi', 'quartz']",20190504 0019290000,pay close attent new york citi quartz,7,-0.1027,0
1664,"['pay', 'close', 'attent', 'new', 'york', 'citi', 'quartz']",20190504 0019160000,pay close attent new york citi quartz,7,-0.1027,0
1665,"['new', 'york', 'strike', 'ahead']",20190504 0019030000,new york strike ahead,4,-0.128,-1
1666,['whereto'],20190504 0018470000,whereto,1,0.0,0
1667,"['bewar', 'anoth', 'taxi', 'compani', 'bankruptci']",20190504 0018130000,bewar anoth taxi compani bankruptci,5,0.0,0
1668,"['stage', 'massiv', 'strike']",20190504 0018100000,stage massiv strike,3,-0.128,0
1669,"['grow', 'revenu', 'fast', 'manag', 'would', 'like', 'believ', 'burn', 'cash', 'like', 'trust', 'fund', 'babi', 'shop', 'spree']",20190504 0015290000,grow revenu fast manag would like believ burn cash like trust fund babi shop spree,15,0.8074,0
1670,"['hand', 'weigh', 'idea', 'billion', 'vision', 'fund']",20190504 0011070000,hand weigh idea billion vision fund,6,0.6369,0
1671,"['week', 'ahead', 'market', 'weve', 'got', 'runaway', 'freight', 'train', 'market', 'id', 'love', 'see', 'darn', 'thing', 'cool', 'session', 'two', 'host', 'said']",20190504 0009030000,week ahead market weve got runaway freight train market id love see darn thing cool session two host said,19,0.7579,0
1672,"['report', 'bar', 'ex', 'balconi']",20190504 0008220000,report bar ex balconi,4,0.0,0
1673,"['report', 'bar', 'ex', 'balconi', 'stock']",20190504 0008220000,report bar ex balconi stock,5,0.0,0
1674,"['report', 'bar', 'ex', 'balconi']",20190504 0007200000,report bar ex balconi,4,0.0,0
1675,"['central', 'build', 'make', 'larg', 'data', 'access', 'effect', 'make']",20190504 0000360000,central build make larg data access effect make,8,0.0,-1
1677,"['alert', 'launch', 'day', 'estim', 'return']",20190505 2354050000,alert launch day estim return,5,0.296,0
1678,"['peopl', 'around', 'talk', 'sudden', 'urg', 'spare', 'miser', 'also', 'realli']",20190505 2348350000,peopl around talk sudden urg spare miser also realli,9,-0.4215,0
1679,"['us', 'week', 'biggest']",20190505 2345340000,us week biggest,3,0.0,0
1680,"['readi', 'yahoo', 'financ']",20190505 2343210000,readi yahoo financ,3,0.0,0
1681,"['share', 'buy', 'come', 'back', 'higher']",20190505 2341240000,share buy come back higher,5,0.296,0
1682,"['uncensor', 'next', 'week', 'uncensor', 'discuss', 'green', 'initi', 'noth', 'avocado']",20190505 2335370000,uncensor next week uncensor discuss green initi noth avocado,9,0.0,0
1683,"['former', 'travi', 'balconi']",20190505 2333070000,former travi balconi,3,0.0,0
1684,"['plan', 'strike', 'ahead']",20190505 2329290000,plan strike ahead,3,-0.128,0
1685,"['one', 'everyon', 'theyr', 'theyr', 'profit']",20190505 2328160000,one everyon theyr theyr profit,5,0.4404,0
1686,"['buy', 'sell', 'buy']",20190505 2326560000,buy sell buy,3,0.0,0
1687,"['hold', 'anyth', 'market', 'big', 'open', 'dip', 'move', 'back', 'way', 'still']",20190505 2326390000,hold anyth market big open dip move back way still,10,0.0,0
1689,"['bring', 'tax', 'resist', 'least', 'six', 'major', 'tech', 'go', 'public', 'year', 'gener', 'entic', 'opportun']",20190505 2322030000,bring tax resist least six major tech go public year gener entic opportun,13,0.0,0
1690,"['earn', 'know', 'week', 'ahead']",20190505 2319200000,earn know week ahead,4,0.0,0
1691,"['plan', 'strike', 'ahead']",20190505 2317320000,plan strike ahead,3,-0.128,0
1692,"['miss', 'window', 'year', 'bull', 'market', 'would', 'thing', 'ever', 'make', 'happen']",20190505 2316370000,miss window year bull market would thing ever make happen,10,-0.1531,0
1693,"['plan', 'strike', 'ralli', 'ahead']",20190505 2309000000,plan strike ralli ahead,4,-0.128,0
1694,"['earn', 'ahead']",20190505 2307210000,earn ahead,2,0.0,0
1695,"['worri', 'may']",20190505 2305060000,worri may,2,0.0,0
1696,"['us', 'ride', 'share', 'strike', 'may', 'ahead', 'via']",20190505 2304500000,us ride share strike may ahead via,7,0.1779,-1
1697,"['get', 'readi', 'bonanza', 'set', 'go', 'public', 'next', 'day', 'bubbl', 'least', 'signal', 'end', 'long', 'boom', 'cycl', 'cours', 'far', 'among']",20190505 2303250000,get readi bonanza set go public next day bubbl least signal end long boom cycl cours far among,18,0.0,0
1698,"['week', 'plan', 'strike', 'protest']",20190505 2303130000,week plan strike protest,4,-0.3612,-1
1699,"['bewar', 'authorit', 'account', 'went', 'wrong', 'scrambl', 'avoid', 'fate']",20190505 2302170000,bewar authorit account went wrong scrambl avoid fate,8,-0.6486,0
1700,"['million', 'ahead', 'case', 'insid', 'trade', 'via']",20190505 2301360000,million ahead case insid trade via,6,0.0,0
1701,"['build', 'busi', 'present', 'pitch', 'one', 'worth', 'particular']",20190505 2300130000,build busi present pitch one worth particular,7,0.2263,0
1702,"['get', 'readi', 'week', 'ahead', 'earn', 'game', 'plan']",20190505 2300070000,get readi week ahead earn game plan,7,0.0,0
1703,"['hour', 'relationship', 'come']",20190505 2300000000,hour relationship come,3,0.0,0
1704,"['hour', 'relationship', 'come']",20190505 2300000000,hour relationship come,3,0.0,0
1705,"['former', 'travi', 'balconi']",20190505 2252070000,former travi balconi,3,0.0,0
1706,"['plan', 'strike', 'ralli', 'ahead']",20190505 2251290000,plan strike ralli ahead,4,-0.128,0
1707,"['new', 'york', 'strike', 'ahead']",20190505 2251250000,new york strike ahead,4,-0.128,-1
1708,"['fetch', 'know', 'play', 'money', 'like', 'direct', 'overhead', 'like', 'brick', 'mortal', 'store']",20190505 2248040000,fetch know play money like direct overhead like brick mortal store,11,0.7506,0
1709,"['keep', 'watch', 'like', 'sneaker', 'releas', 'everybodi', 'abl', 'get', 'refer', 'messag']",20190505 2247050000,keep watch like sneaker releas everybodi abl get refer messag,10,0.3612,0
1713,"['sure', 'end', 'fountain', 'scene', 'amaz', 'work', 'team', 'thank', 'invit', 'us', 'tini', 'part']",20190505 2232420000,sure end fountain scene amaz work team thank invit us tini part,12,0.5859,0
1714,"['tech', 'unicorn', 'month', 'may', 'preview', 'video']",20190505 2219540000,tech unicorn month may preview video,6,0.0,0
1715,"['mau', 'jeff', 'bakal']",20190505 2215060000,mau jeff bakal,3,0.0,0
1716,"['tech', 'unicorn', 'month', 'may', 'preview', 'video', 'unicorn']",20190505 2214590000,tech unicorn month may preview video unicorn,7,0.0,0
1717,"['south', 'trade']",20190505 2214290000,south trade,2,0.0,0
1718,['jeff'],20190505 2204320000,jeff,1,0.0,0
1719,"['keep', 'smart', 'money', 'play', 'econom']",20190505 2200000000,keep smart money play econom,5,0.6249,0
1720,"['mau', 'jeff', 'bakal']",20190505 2146010000,mau jeff bakal,3,0.0,0
1721,"['bakal', 'alia', 'di', 'bursa', 'men']",20190505 2139390000,bakal alia di bursa men,5,0.0,0
1722,"['effect', 'way', 'protest', 'nationwid', 'boycott', 'solidar', 'theyr', 'strike', 'wed', 'protest', 'come', 'dont', 'buy', 'anyth', 'wed', 'twitter']",20190505 2133550000,effect way protest nationwid boycott solidar theyr strike wed protest come dont buy anyth wed twitter,16,-0.7003,0
1723,"['tech', 'columnist', 'rise', 'compani', 'goe', 'public', 'opinion', 'columnist', 'new', 'york', 'time', 'upcom', 'may', 'busi']",20190505 2132110000,tech columnist rise compani goe public opinion columnist new york time upcom may busi,14,0.0,0
1724,"['bakal', 'alia', 'di', 'bursa', 'jeff']",20190505 2131560000,bakal alia di bursa jeff,5,0.0,0
1725,"['la', 'de', 'la', 'beyond', 'meat', 'zoom', 'han', 'post', 'ha', 'la', 'pone', 'en', 'la']",20190505 2131090000,la de la beyond meat zoom han post ha la pone en la,13,0.34,0
1726,"['mau', 'jeff', 'bakal', 'bakal']",20190505 2130120000,mau jeff bakal bakal,4,0.0,0
1727,"['new', 'technolog', 'stori', 'tech', 'columnist', 'rise', 'compani', 'goe', 'public', 'opinion', 'columnist', 'new', 'york', 'time', 'upcom']",20190505 2129330000,new technolog stori tech columnist rise compani goe public opinion columnist new york time upcom,15,0.0,0
1728,"['mau', 'jeff', 'bakal']",20190505 2127560000,mau jeff bakal,3,0.0,0
1729,"['new', 'stori', 'tech', 'columnist', 'rise', 'compani', 'goe', 'public', 'opinion', 'columnist', 'new', 'york', 'time', 'upcom']",20190505 2127160000,new stori tech columnist rise compani goe public opinion columnist new york time upcom,14,0.0,0
1730,"['bakal', 'alia', 'di', 'bursa', 'jeff']",20190505 2126080000,bakal alia di bursa jeff,5,0.0,0
1731,['killer'],20190505 2123560000,killer,1,-0.6486,0
1732,"['strike', 'ahead']",20190505 2121520000,strike ahead,2,-0.128,-1
1733,"['el', 'de', 'el', 'la']",20190505 2120260000,el de el la,4,0.0,0
1734,"['plan', 'strike', 'ahead', 'share', 'social', 'network', 'know', 'read', 'plan', 'strike']",20190505 2118460000,plan strike ahead share social network know read plan strike,10,0.0516,0
1735,"['south', 'trade', 'via']",20190505 2117380000,south trade via,3,0.0,0
1736,"['bring', 'tax', 'resist', 'among', 'least', 'six', 'valu', 'billion', 'go', 'public', 'year', 'new', 'class']",20190505 2109250000,bring tax resist among least six valu billion go public year new class,13,0.0,0
1737,"['pretti', 'ridicul', 'like']",20190505 2108310000,pretti ridicul like,3,0.3612,0
1738,"['plan', 'strike', 'ahead', 'strike', 'day', 'initi', 'public']",20190505 2108130000,plan strike ahead strike day initi public,7,-0.25,0
1739,"['check', 'stori', 'one', 'occur', 'year', 'bay', 'area', 'tell', 'east', 'coast', 'big', 'tech', 'us']",20190505 2105390000,check stori one occur year bay area tell east coast big tech us,13,0.0,0
1740,"['jay', 'z', 'compani', 'soon', 'hell', 'make', 'million', 'us', 'invest', 'rap', 'wonder', 'wale', 'last', 'need', 'start', 'grow', 'togeth']",20190505 2103460000,jay z compani soon hell make million us invest rap wonder wale last need start grow togeth,17,-0.6808,0
1741,"['watch', 'ralli', 'beyond', 'meat', 'next', 'seek', 'alpha']",20190505 2103170000,watch ralli beyond meat next seek alpha,7,0.0,0
1742,"['mean', 'lower', 'joe', 'ye']",20190505 2100300000,mean lower joe ye,4,-0.296,0
1743,"['special', 'everyth', 'need', 'know']",20190505 2058290000,special everyth need know,4,0.4019,0
1744,"['thank', 'mike', 'articl', 'today', 'two', 'small', 'ye', 'look', 'brilliant', 'might', 'accur', 'add', 'word', 'white', 'mind', 'go', 'white']",20190505 2054170000,thank mike articl today two small ye look brilliant might accur add word white mind go white,17,0.743,0
1745,"['busi', 'grew', 'revenu', 'last', 'year', 'growth', 'year', 'eat', 'suppos', 'second', 'busi', 'fell', 'quarter', 'via']",20190505 2051010000,busi grew revenu last year growth year eat suppos second busi fell quarter via,14,0.3818,-1
1746,"['public', 'take', 'center', 'stage']",20190505 2050350000,public take center stage,4,0.0,0
1747,"['month', 'watch', 'beer', 'mist']",20190505 2049150000,month watch beer mist,4,0.0,0
1748,"['dont', 'drive', 'dont', 'ride', 'may']",20190505 2044430000,dont drive dont ride may,5,0.0,0
1749,"['yeah', 'rais', 'still', 'stock', 'price', 'point', 'basic', 'rais', 'taxi', 'essenti', 'fire', 'public', 'transit']",20190505 2043530000,yeah rais still stock price point basic rais taxi essenti fire public transit,13,-0.0516,0
1750,"['say', 'could', 'see', 'disrupt', 'there', 'problem']",20190505 2041360000,say could see disrupt there problem,6,-0.4019,0
1751,"['chao', 'mother', 'come', 'week', 'top', 'dont', 'know']",20190505 2038280000,chao mother come week top dont know,7,0.2023,0
1752,"['period', 'ni', 'si']",20190505 2030360000,period ni si,3,0.0,0
1753,"['lose', 'lot', 'money', 'probabl', 'never', 'make', 'money', 'ass', 'buy']",20190505 2030350000,lose lot money probabl never make money ass buy,9,0.0387,0
1754,"['earn', 'test', 'drive', 'track']",20190505 2022020000,earn test drive track,4,0.0,0
1755,"['strike', 'ahead', 'today']",20190505 2020080000,strike ahead today,3,-0.128,-1
1756,"['strike', 'san', 'new', 'york', 'may', 'ahead', 'join', 'day']",20190505 2016330000,strike san new york may ahead join day,8,0.1779,-1
1757,"['effect', 'way', 'protest', 'nationwid', 'boycott', 'solidar', 'theyr', 'strike', 'wed', 'protest', 'come', 'dont', 'buy', 'anyth', 'wed', 'twitter']",20190505 2007060000,effect way protest nationwid boycott solidar theyr strike wed protest come dont buy anyth wed twitter,16,-0.7003,0
1758,"['unicorn', 'landscap', 'account', 'almost', 'valu', 'entir', 'valuat']",20190505 1958290000,unicorn landscap account almost valu entir valuat,7,0.0,0
1759,"['dont', 'let', 'take', 'ride', 'via']",20190505 1955540000,dont let take ride via,5,0.0,0
1760,"['ahead', 'riski', 'founder', 'link', 'ticker', 'prime', 'invest', 'solut']",20190505 1944320000,ahead riski founder link ticker prime invest solut,8,0.0,0
1761,"['great', 'summari', 'face', 'never', 'come', 'massiv', 'heath', 'warn', 'buyer']",20190505 1944070000,great summari face never come massiv heath warn buyer,9,0.5719,0
1762,"['compani', 'ride', 'share', 'strike', 'may', 'ahead', 'via']",20190505 1940400000,compani ride share strike may ahead via,7,0.1779,-1
1763,"['spuriou', 'mere', 'littl', 'realiti', 'still', 'million', 'though']",20190505 1933510000,spuriou mere littl realiti still million though,7,0.0,0
1764,"['um', 'test', 'drive', 'ant', 'da']",20190505 1924020000,um test drive ant da,5,0.0,0
1765,"['billion', 'vision', 'slack']",20190505 1920510000,billion vision slack,3,0.25,0
1766,"['dont', 'let', 'take', 'ride', 'via']",20190505 1919590000,dont let take ride via,5,0.0,0
1767,"['strike', 'offer', 'led', 'morgan', 'bank', 'compani', 'price', 'may', 'begin', 'trade', 'new', 'york', 'stock', 'exchang', 'follow', 'day', 'symbol']",20190505 1917240000,strike offer led morgan bank compani price may begin trade new york stock exchang follow day symbol,17,-0.128,0
1768,"['wrote', 'file', 'think', 'pay', 'much', 'alreadi', 'corpor', 'set', 'make', 'left', 'poverti', 'go']",20190505 1916020000,wrote file think pay much alreadi corpor set make left poverti go,12,-0.1027,0
1769,"['travi', 'board', 'could', 'help', 'ring', 'open', 'bell', 'day', 'request']",20190505 1914330000,travi board could help ring open bell day request,9,0.4019,0
1770,"['big', 'road', 'show', 'inform', 'told', 'road', 'show', 'expect', 'compani', 'one', 'day', 'earn', 'profit', 'margin']",20190505 1909280000,big road show inform told road show expect compani one day earn profit margin,14,0.4404,0
1771,"['un', 'la', 'dinero', 'ha', 'el', 'anterior', 'la']",20190505 1907040000,un la dinero ha el anterior la,7,0.34,1
1772,"['flunk', 'smell', 'test']",20190505 1906390000,flunk smell test,3,-0.3182,0
1773,"['report', 'bar', 'ex', 'balconi']",20190505 1905140000,report bar ex balconi,4,0.0,0
1774,"['could', 'rais', 'billion', 'billion', 'valuat']",20190505 1904530000,could rais billion billion valuat,5,0.0,0
1775,"['us', 'readi', 'massiv', 'strike', 'ahead', 'drive', 'via']",20190505 1900430000,us readi massiv strike ahead drive via,7,-0.128,0
1776,"['spi', 'updat', 'choppi', 'consolid', 'see', 'price', 'key', 'avoid', 'boredom', 'high', 'probabl', 'lite', 'di', 'baba']",20190505 1859510000,spi updat choppi consolid see price key avoid boredom high probabl lite di baba,14,-0.5423,0
1777,"['whereto', 'dont', 'know']",20190505 1859070000,whereto dont know,3,0.0,0
1778,"['outlook', 'week', 'via']",20190505 1856010000,outlook week via,3,0.0,0
1779,"['public', 'take', 'center', 'stage']",20190505 1854420000,public take center stage,4,0.0,0
1780,"['news', 'week', 'treasuri', 'complianc', 'guid', 'judg', 'deal', 'occident', 'chevron']",20190505 1850590000,news week treasuri complianc guid judg deal occident chevron,9,0.0,0
1781,"['es', 'la', 'de', 'lune', 'un']",20190505 1848380000,es la de lune un,5,0.0,0
1782,"['mon', 'lite', 'trade', 'di', 'baba', 'cell', 'phone', 'mo', 'eu']",20190505 1846480000,mon lite trade di baba cell phone mo eu,9,0.0,0
1783,"['us', 'ride', 'share', 'strike', 'may', 'ahead', 'via']",20190505 1843410000,us ride share strike may ahead via,7,0.1779,-1
1784,"['plan', 'strike', 'compani', 'toward']",20190505 1839510000,plan strike compani toward,4,-0.128,0
1785,"['file', 'potenti', 'inabl', 'attract', 'maintain', 'critic', 'mass', 'would', 'make', 'platform', 'less', 'appeal', 'platform']",20190505 1839000000,file potenti inabl attract maintain critic mass would make platform less appeal platform,13,0.1027,0
1786,"['us', 'ride', 'share', 'strike', 'may', 'ahead', 'via']",20190505 1838410000,us ride share strike may ahead via,7,0.1779,-1
1787,"['hard', 'envis', 'rough', 'confid', 'price', 'right', 'confid']",20190505 1836070000,hard envis rough confid price right confid,7,-0.1027,0
1788,"['appreci', 'compliment', 'yeah', 'also', 'took', 'consider', 'issu', 'column', 'day', 'moral', 'stain', 'silicon', 'valley', 'despit', 'say', 'use', 'indentur', 'servantlik', 'everi']",20190505 1833170000,appreci compliment yeah also took consider issu column day moral stain silicon valley despit say use indentur servantlik everi,19,0.6486,0
1789,"['public', 'take', 'center', 'stage', 'even', 'decad', 'privat', 'overwhelmingli', 'fund', 'innov', 'dynam']",20190505 1832330000,public take center stage even decad privat overwhelmingli fund innov dynam,11,0.0,0
1790,"['panic', 'button']",20190505 1829060000,panic button,2,-0.5106,0
1791,"['kirker', 'gener', 'disappoint', 'busi', 'press', 'coverag', 'deepli', 'flaw', 'lot', 'dig', 'supposedli', 'top', 'notch', 'like', 'mike']",20190505 1825450000,kirker gener disappoint busi press coverag deepli flaw lot dig supposedli top notch like mike,15,0.1531,0
1792,"['public', 'take', 'center', 'stage']",20190505 1825310000,public take center stage,4,0.0,0
1793,"['public', 'take', 'center', 'stage', 'tech']",20190505 1825310000,public take center stage tech,5,0.0,0
1795,"['link', 'one', 'sex', 'attack', 'week']",20190505 1818210000,link one sex attack week,5,-0.4767,-1
1796,"['public', 'take', 'center', 'stage', 'even', 'decad', 'privat', 'overwhelmingli', 'fund', 'innov', 'dynam', 'world', 'public', 'day']",20190505 1817440000,public take center stage even decad privat overwhelmingli fund innov dynam world public day,14,0.0,0
1797,['dodgi'],20190505 1817320000,dodgi,1,0.0,0
1798,"['south', 'trade', 'time', 'start', 'everi', 'week', 'front', 'foot', 'preview', 'watch', 'via', 'entrepreneur']",20190505 1813280000,south trade time start everi week front foot preview watch via entrepreneur,12,0.0,0
1799,"['us', 'ride', 'share', 'strike', 'may', 'ahead']",20190505 1811150000,us ride share strike may ahead,6,0.1779,-1
1800,"['what', 'take', 'horrid', 'unit', 'econom', 'go', 'well', 'success', 'bad', 'unit', 'econom', 'dont', 'alway', 'mean', 'bad']",20190505 1806140000,what take horrid unit econom go well success bad unit econom dont alway mean bad,15,0.1655,0
1801,['see'],20190505 1801530000,see,1,0.0,0
1802,"['top', 'stori', 'see']",20190505 1801530000,top stori see,3,0.2023,0
1803,"['top', 'stori', 'see']",20190505 1801530000,top stori see,3,0.2023,0
1804,"['doesnt', 'want', 'cofound', 'travi', 'ring', 'bell', 'show', 'past', 'raucou', 'earli']",20190505 1801060000,doesnt want cofound travi ring bell show past raucou earli,10,-0.0572,0
1805,"['hour', 'relationship', 'come']",20190505 1800000000,hour relationship come,3,0.0,0
1806,"['san', 'home', 'wait', 'upcom']",20190505 1739280000,san home wait upcom,4,0.0,0
1807,"['cours', 'year', 'stop', 'drive', 'exclus', 'today', 'run', 'interest', 'properti', 'passeng', 'wine', 'car', 'told', 'eat']",20190505 1739100000,cours year stop drive exclus today run interest properti passeng wine car told eat,14,0.2023,0
1808,"['say', 'trade', 'big', 'problem', 'zombi', 'corpor', 'cant', 'make', 'money', 'zero', 'hedg']",20190505 1729340000,say trade big problem zombi corpor cant make money zero hedg,11,-0.4019,0
1809,"['new', 'york', 'strike', 'ahead']",20190505 1724030000,new york strike ahead,4,-0.128,-1
1811,"['melt', 'look', 'use', 'caution', 'trump', 'card', 'may', 'market', 'may', 'buoy', 'big', 'name']",20190505 1719570000,melt look use caution trump card may market may buoy big name,12,0.0,0
1812,['readi'],20190505 1707010000,readi,1,0.0,0
